1.0, 一群人格分裂症，整部剧不知道谁是主角，各种乱伦，n角关系，几乎剧里所有的人都参加到这场乱伦中，把中华文化毁的渣渣都不剩了，观音菩萨暗恋唐僧，唐僧是孙悟空的儿子，那观音不成孙悟空的儿媳妇了吗，而且还是一始终山寨的孙悟空，简直不能太辣眼！
2.0, 剧情狗血 演员出戏 造型夸张 美术还可以 找不到什么笑点 台词有点过于讨人喜的感觉 两星不能再多
1.0, 别在消费观众的大话情怀了好吗。希望不要有下一部，别的不多说了。
1.0, 年度烂片之一
2.0, 跳剧好严重 而且唐嫣演技太感人 还有 后面取经的是居然是六耳猕猴 天哪  不是很难看 但没有大话西游二一般看第一遍时笑 看第二遍时哭 并且回味悠长 快餐电影
1.0, 卧槽，他娘的 垃圾片啊
1.0, 一部在影院看不下去的电影。
1.0, 烂就一个字，我只说一次。
1.0, 连5分钟都看不了的烂片啊 真毁经典
1.0, 看了那些水军的无脑五星评论，你们真看电影了没？貌似自己都不好意思吹。
1.0, 真心只是打着大话西游名头的一部圈钱烂片
1.0, 原因都懂
1.0, 猜到了会很烂，但是没想到会这么烂，本来不想折磨自己看的，但是电影院无耻的不排其他影片，我忍了。但是你翻拍就算了，至少用点心吧！唐三藏居然是六耳猕猴和青霞仙子的儿子，我的天啦，编剧你怎么不上天呢，利用我们的情怀，欺骗我们的感情，简直无耻，不能容忍，一直炒冷饭，有意思么？超级大烂片！
1.0, 先不说演员演技不行，内容就好比英语考试学渣抄学霸的选择题，学渣只知道选A B C D ，永远看不懂试卷的内容是什么
1.0, 为什么不能给负分
4.0, 大话西游原作1，2部看过多遍，大话西游3作为原作粉还是值得一看的，解决了很多原作留下的疑团，唐僧依旧是搞笑担当，3d效果也很逼真，有vr的感觉，值得一看。想当年大话西游狂改西游记还不是迎来市场狂喷，所以原导演再续前作，也没什么，大家不必太苛责了。
4.0, 比想象中好，唐嫣认真起来还是有演技的
1.0, 浪费我情怀的一个产物
1.0, 我看看刘胖子还有多少钱，能请多少水军
1.0, 毁吧 继续毁吧
1.0, 无语
2.0, 唐嫣本人我是挺喜欢的，但是电影确实不行，剧情不行，笑料不行，演技更不行，好多看得太让人尴尬了，珠玉在前，电影注意不行，不过爆米花商业片看看也无妨吧
1.0, 无力吐槽，一颗星都嫌多
1.0, 互联网时代要么做早，赚个新鲜。要么做好赚个人气。做不早也做不好，就只能做糟，有胆子敢拿大话西游出来翻拍的，就是想效仿凤爪女.刘梓晨等网络丑，到观众这里讨个骂名就好了。观众骂的越厉害，影片就越有人气。从商业的角度就越成功。所以整个导演组乐得如此。
2.0, 和20前的比 差距太大
4.0, 有情怀有故事有满足有遗憾，喜欢唐嫣对紫霞、青霞的演绎，阴阳双芯，同身异命，个性分明，很美！
1.0, 除了吴京 我记不起别人了
2.0, 怎么说呢，不喜欢这种喜剧~觉得没意思啊
5.0, 不知道为什么看到这么多差评，也许是我来豆瓣没多久，也许是每个人的品味不同，但我认为这部片子在我这里是合格的，唐嫣韩庚演技并不让我出戏，剧情也挺搞笑，逻辑性也还可以，可以一看。
4.0, 开头有些混乱，搞不清他们的穿越到底什么情况，然后慢慢渐入佳境，延续西游2的主旨，用神仙爱情隐喻如今的饮食男女爱情观，十分有趣！唐嫣的演技大有进步，一人分饰两角，十分有戏！最终有情人终成眷属，在中秋节看十分应景！
1.0, 太烂了 可怕 刘镇伟什么时候能停止吃自己的老本
2.0, 以情怀圈钱的烂片！
1.0, 看演员识烂片系列
1.0, 太烂了 没法跟周版比 一点都没笑想谁的节奏 完全不想给星 建议别看 没任何看点 烂到家了 今年最烂
0, 腊鸡！什么玩意！
1.0, 烂到窒息，要不是陪人去看我早中途离场了
5.0, 这样的大话西游让我想起了最初的爱情，我们为了他不管不顾的时候
1.0, 浪费钱
1.0, 这部大话西游只是茫茫烂片里的一部罢了
1.0, 不能再烂了
1.0, 无语凝噎
1.0, 垃圾电影
1.0, 看的尴尬症又犯了
0, 求唐嫣放过紫霞，刘镇伟放过大话，大爱韩庚变4演技，演个路人就很好啊当什么主角。
1.0, 滚！！！！！！
1.0, 垃圾，没有周星驰的大话西游就是垃圾
1.0, 果然，预告都已经脱离轨道。
1.0, 我真的是认真看完的，除了“人格分裂是一种妇科疾病”还能证明他是刘镇伟，其他的真的只能说江郎才尽了。
3.0, 看完觉得没有评论说那么差，开始比较无聊往下看还好，有些出乎意料但都还圆回来了，各方人物安排的还好。韩庚演绎的至尊宝是真不行但孙悟空还可以
1.0, 什么jb玩意？
1.0, 垃圾，用名字来骗钱的，换个名字谁来看
5.0, 打五星是为了平衡，和妈妈一起看的，她看不懂剧情但是笑得很开心。唐嫣的颜其实还不错，给了大话一个圆满结局
0, 本报着挺大希望看的电影  没想到会有些失望  细节有些low  感觉演员都没有爆发出出众的演技……
1.0, 一星给阿娇和莫文蔚😌
1.0, 内容真实和封神一样一样的无趣，时代发展了内容怎么会空白如此
1.0, 特效可以。台词剧情人物塑造我不理解。因为想骂脏话。
1.0, 失望是在所难免的，找不到半点当年大话西游的情怀。表演做做，剧情太烂。不过仅代表个人观点，电影院里面也有个别人笑得不行，引来一样的目光。
1.0, 唐嫣带个美瞳就已经失去了一切兴趣，你不知道紫霞仙子最美的是眼睛吗？！！！
5.0, 挺搞笑的，不知道为什么黑子那么多，大半夜的刷分，评分从5.8掉到4.9，真是垃圾，大话西游三是动了谁的蛋糕，需要这样下力气黑
1.0, 看到两个主演我就知道这绝对是个烂片！！为什么唯一让我有点儿安慰的是莫文蔚和吴京了，但这改变不了什么，只想对这部影片说滚
1.0, 难看
1.0, 如果电影名不叫这个，我可能还不会这么失望，还可以多打两星，但是话说回来，不叫这个名字，我也不会进去看。续集本来就不好拍，整个电影拿出来单看，就很一般，作为经典的续集，就更经不起比较。实话是，有点被骗的感觉。
1.0, 如果有负分我就打负分了，两个主角拜托可以去演技速成班学一下再来演戏么？演的什么玩意儿，电影我都没看完我就出去了，实在是太难看了。
1.0, 一个字 烂 不想多说了
1.0," 原版大话虽然用无厘头和搞笑的方式来讲故事，但是承载的是很真挚的情怀，故事中的人，该有的认真，纠结，爱情，都是很饱满的，性格的层次都是很复杂的。我们看的时候，代入感和共鸣才会那么强烈。
而看大话三，就像在看一个不搞笑但是用尽力气在挠痒痒的小品，真是尴尬。"
1.0, 吴京饰演的唐僧还挺搞笑，实在挑不出其他值得称道的地方了。
1.0," 无语O__O""…"
1.0, 希望唐嫣不要接电影了....电视剧好歹不花我钱呢....
1.0, 天呐，好毁经典。
5.0, 如果你对大话西游有遗憾，建议去看
1.0, 竟然有5.8这么高
5.0, 天定的安排原来也可以是错的，大话西游有了一个美好的结局，不再是一部悲剧了，最令人动容的还是那首所有人都会唱的歌<一生所爱>。
1.0, 浪费了我一下午时间...
1.0, 以后谁再翻拍大话西游统统拉出去枪毙
1.0, 在这部电影的评论里面，好评才是亮点
1.0, 真垃圾
1.0, 一颗心给秦祥林和青霞，作为在这个影片中唯一让我感受到内容的部分。整部影片莫名觉得紫霞和至尊宝的主角光环被另外两位掩盖，紫霞前半段还好，至尊宝整个就炮灰了。私以为，小时代和它比起来都算有内容，有内涵的影片了。当年紫萱的美好形象，不知道为何在这部中荡然无存。
2.0, 看到韩庚的表演简直了。。。
1.0, 大话西游导演虽然挂的的刘镇伟的导演，但是一开始他是不承认的，因为里面的东西基本都是周星驰的，而不是他的，后面看着大话火了，他又承认是他拍的，我只想问，节操呢
5.0, 刘镇伟和周星驰之间差了1000万个银河系
2.0, 没看之前以为会很烂，不过看完之后更加坚信了这一点，影院里面有几个六七岁的小孩子但是笑得挺开心，这兴许是我给他两星的原因吧。
4.0, 想象之中，意料之外。果然只有刘镇伟导演才能填补之前遗留的bug，虽然脑洞略大，但全场都笑得很欢乐。韩庚的六耳猕猴，唐嫣的青霞，真真是最触动我，真正爱一个人，愿意成全他的一切，但所谓自由，却不过是一场漂泊。幸好，结局是圆满的。大话二十一载，爱你依旧一万年。
1.0, 够了，真的够了。
0, 好烂
1.0," 奔着看雷剧去的打算，果然不出所料，全程不知在看什么鬼
哦，在看六耳猕猴和青霞生了唐僧？
哎哎哎……不想说什么了。"
1.0, 什么也不想说了 心疼电影票钱
1.0, 看完了预告后，我感觉整个人都不好了，可以料想得到，一部史前巨制烂片即将出场。
1.0, 毁经典
3.0, 吴金是来搞笑的，唯一记住的台词～醉过才知酒浓，爱过方知情重
4.0, 我是星爷粉，翻拍经典几乎无一例外的会被骂，这部电影当然跟1，2两部有很大差距，但是绝对没有到烂片的程度。只是连电影都没看就跑来刷一星差评，对演员进行与电影无关的人身攻击的人，真是个大写的low。
5.0, 还不错。刚开始看预告的时候觉得特效有问题，真正看的时候，意外感觉还不错。唐嫣的青霞紫霞切换自如，还不错哦！我本来比较公平的按自己的心意打四星。后来发现恶意刷一星的太多了！很多在没上映之前就在刷，一直说情怀，显得自己特有调调似的！
5.0," 打五分是为了平衡那些看都没看就打一分的。

电影故事性很差，喜剧桥段虽比较僵硬，但有个别桥段还是可以吸引人的。比如一生所爱！

3d效果还不错。特效很多一言不合就开7毛钱特效。

比预期要好很多，所以看完之后的感觉是除了演技外其他还行。
所以说人嘛，期望太高会不开心的"
1.0, 可以打零分吗？
5.0, 看喷子太多我直接给五星吧
5.0, 想看不需要理由
4.0, 还可以吧
4.0, 当年的大话1.2票房狗屎一样，都说是烂片。录像带传播之后，立马高大上了。如今大话3都说是狗屎，票房独霸九月档，引申一个老话题：口碑重要，还是票房重要？
1.0, 唐僧是悟空儿子，我就靠了！！
3.0, 骑牛那里，特效真是…烂啊……是比不过周星驰的至尊宝和朱茵的紫霞仙子。呐，我真的特别喜欢大话西游1和2，不说了，去重看了
1.0, 才看到水军那么不负责任，看着唐嫣面无表情的，有啥灵气，找借口编个靠得住的
5.0, 挺不错的，留下完美的结局，准备二刷。
1.0, 这到底是什么鬼，什么鬼，什么鬼……
2.0, 我印象中的紫霞仙子是俏皮可爱，古灵精怪，对爱情充满向往的仙女，不是冷冰冰的冰山美人
1.0, 导演抄冷饭，男主演技渣，剧情不深究，留点小面子
1.0, 垃圾电影
1.0, 没有星爷的大话西游，根本就不是大话西游。
1.0, 巨烂无比
1.0, 这片虽然还没看，但一直在关注豆瓣评分，分数真不咋地！吐槽实在太多！豆瓣评分变化也很离谱，一开始看5.2，然后4.9，过了中秋节，神不知鬼不觉又变到5.4（水军过完中秋该上班了！），变化实在太大。断定水军横行无疑！虽没看，果断1星！
4.0, 一半喜一半悲
1.0, 没看过，冲着过度消费西游，就给一星
1.0, 炒冷饭，哼哼
1.0, 这演技！这台词！话都说不清楚，都不知道说了些什么，无言以对！
4.0, 李涛，不是任何演员的粉丝，本就是冲着大话西游四个字去看的，一种难以割舍的情怀吧，说实话还是有惊喜到，六耳猕猴和青霞还是很棒的，吴京原来也能演出喜剧天赋，惊喜，我觉得评分不止五点几吧，七八分还是可以达到的，星爷大话无可超越，大话3也算良心了
1.0, 剧情无厘头不评价，特效是真想采访下剧组咋才能把特效拍的比老版还差
4.0, 三部大话西游讲了个完整的故事，已经值得了
0, 看了预告片 3分特效 没什么看头
1.0, 什么傻屌一样的东西。
3.0, 可以给六分 比想象的要强些，六耳的这条线是亮点
1.0, 不想吐槽什么了。因为穿越了，所以剧情大部分和之前的相同，连台词都不改，只是变成了无剧情、无演技、无特效的三无炒冷饭。怪物设计，呵呵，寄生兽、美杜莎和蝙蝠怪的合体我也是醉了。最后，拜托别毁经典了。
1.0, 这世界上还有比前更重要的事情
1.0, 一分只是因为顶着大话西游的名字，得给星爷一点面子
1.0, 莫名其妙的剧情，垃圾的特效，一部电影为了立意而去立意，生硬不协调。一首一生所爱变成了音乐剧的感觉，似是而非。整个电影就是越光宝盒，大话天仙的配置，还哪里有大话西游经典的样子，我不知道刘镇伟是才尽了还是变成傻b了。傻白甜唐嫣虽然演技一般，但还是很可爱。唯一的一星送给吴京的精彩表现。
1.0, 太烂
5.0, 挺好笑的啊，为什么评分这么低
1.0, 不好看，
1.0, 改的乱七八糟的，，不谈恋爱就不会拍了把。所有人都得安排恋爱，还解答1.2的疑问。脑子有问题的来说说1.2有什么疑问？还至尊宝不认识白晶晶了。。呵呵
1.0, 吴京把自己毁了，也把唐僧毁了，你真的是做死去了
5.0, 可以的，拍的不错
1.0, 唐嫣哪里来的自信演紫霞，辣鸡~
1.0, 看了微博评论，顶着对韩庚的厌恶(ly事件)去看了电影…………韩庚好猥琐越看越恶心演技还差微博上都把他夸上天了还是豆瓣好。。。。一星不能再多了……
5.0, 圆满了大话之梦
1.0, 0分
1.0, 就这还敢放到电影院骗钱？？？
5.0, 哈哈比预期的好很多，错综复杂的关系，六耳猕猴好帅，紧凑的剧情，没有剪辑的乱七八糟，每个人的感情线也交代的很清楚，推荐推荐！
1.0, 嗯，贾玲演的紫霞仙子比这个要好
1.0, 上戏之耻和装逼王真不是开玩笑的。可怜莫。
1.0, 尴尬症，尴尬症，尴尬症，重要的事情说三遍。
1.0, 大话西游3？笑死个人了！挂个大话西游的名，差大话西游137亿光年的距离！刘镇伟只剩炒冷饭了！水军蛮多的！
1.0, 不怕演技烂，就怕编剧脑洞大。唐僧出场方式就怕了。至尊宝和紫霞演的简直弱智。秦祥林青霞，2加个青霞忍了，现在特意的把秦祥林加上是怕观众想不到提醒吗？也许2太虐了，为换个结局脑洞开的这么大。殊不知2就是因为结局才经典，3想换汤换药，为什么情节还要硬扯2？还不如翻拍2换个演员不就行了？
1.0, 刚看完 太难看了 第一次看电影就看了二十分钟出来了
2.0, 看过经典之后，对这个没有感觉，只能说，这部电影特效不错，至于剧情什么的，没点智商的，应该会懵逼的。一部普通搞笑片，就这样😊
1.0, 没错、我竟然看了这部电影是我自己瞎！一个多小时的电影没有任何可取之处、所有主创用自己证明了我就是要不要脸的圈钱、竟然还有人说唐嫣没有带美瞳？那你一定是比我更瞎、从今以后、唐嫣一定被我列入电视剧电影的拒绝往来户、中戏怎么就养出这么个人、太掉自己的名声了
3.0, 爱过 方知情深  醉过 方知酒浓  人生只有一次  千万不要错过
5.0, 豆瓣越来越多人装逼了！曾经沧海难为水，是，星爷朱茵前两部无可超越，但上来就对演员人格侮辱与谩骂的真的是在骂电影吗？电影差你骂电影就是了！这种上来就对演员进行骂的是几个意思？难道导演找你演你还拒绝？人家工作不干了？找你演估计上的比谁都快吧？傻逼太多了！自己是个什么玩意啊！
2.0, 创意和思路是很感人，但是能不能告诉我主线是什么？看了快俩个小时看的轮七八糟，不知讲什么。而且演技看的很尴尬，哭戏看的很想笑
1.0, 刘镇伟你这闹着玩吗？继续炒冷饭
4.0, 很喜欢剧中的青霞 深情与你
2.0, 给两星十年后再给那三星
1.0, 垃圾一样的电影。。。。。
4.0, 看了电影，整体还不错！   感受：特效绝对不止5毛，哈哈   唐嫣饰演紫霞青霞，感觉她演的青霞比紫霞好一点，演技有进步的；韩庚至尊宝演的也说得过去，在这不得不提吴京的唐三藏，艾玛太逗了  还有，编剧脑洞很大，嗯！ 美中不足的是剧情进展有点快……
5.0, 挺喜欢的，适合放假放松心情，尤其男女朋友走起。
1.0, 脸皮真厚，一群垃圾还tm续拍经典，qnmlgb，所有参与这部电影的祝你们全家爆炸，生孩子是弱智。
1.0, 垃圾
1.0, 苍天无眼，这烂片能评到5.4分
5.0, 好看！喜欢青霞和小六这对，很感动，唐嫣和韩庚都演的挺不错的，青霞和紫霞的转换很惊艳，六耳的出现也让人眼前一亮，结局很动人！至于那些狂刷一星的黑子我就不说什么了，毕竟心太黑让人恶心！
1.0, 周星池版的才是大话，这个就是个笑话。
1.0," 看到10分钟，就恶心的不行了，幸亏不是周星驰拍的，一星给唐嫣
从来没评论过电赢，特地来注册一个来评论"
5.0, 然而电影没上映，好多人都给打一星了！原来我一直信任的豆瓣居然是这种德行！ 我作为一个唐嫣的粉丝，我觉得这部纯商业片应该可以得3星！之所以打五星就因为某些人戾气太重！不管不顾，完全没有公正可言！不喜欢可以，但是请尊重！
4.0, 新的尝试，比想象的好
1.0, 没看过，光看阵容就知道打一星都是高的
1.0, 不好笑又不好看！
3.0, 故事完整，笑点有，里面也有无厘头，打戏特效设计不错，整体可以说还行，觉得很多打一分的有点过了。但缺点在于整个片子其他地方没有感受到任何诚意...演员完全出戏，分饰几个角色的演员并没觉得有差别，人物之间感情不动人，完全不感动，许多地方场景和特效也不够精细，经典在前，实在让人如鲠在喉
1.0, 永远都是在炒现饭
4.0, 真的还不错，没看过1.2一开始有点懵后来看懂了。但是演员演技在线，特别青霞和六耳猕猴真心感动到我了。
3.0, 都是老梗，看着尴尬。剧情也有硬伤
1.0, 有雇水军的钱，不如好好用在电影上，何必恶心大家
1.0, 渣渣渣
2.0, 亮点是春十三娘！！！
1.0, 艾玛，不想吐槽了，还我电影票钱，还是我星爷和朱茵的经典，但求以后不要再翻拍经典了，脸打的啪啪的响。
5.0, 对于70后的大话迷来说 对这片本来是不抱什么期望的 心理预期很低所以看了有挺大惊喜 虽然比起1、2差距还是有的 但基本把故事圆了 4星吧 剩下1星平衡没上映就1星黑子黑掉的分
1.0, 绝对的好电影 妈的太好看了 那个老板请问一下 发评论在哪里领钱
2.0, 让唐嫣一饰两角真是为难她了。
2.0, 烂片，目前5.7分这已经是很高了，情节很凌乱，看完后就记住了一条：唐僧是孙悟空的儿子，我打3分，不能再高了。
0, 韩庚的六耳猕猴还可以
1.0, 虽然只是看了预告，但已经足够让我决定，不会去看电影的，更让我确定大话西游1、2部之所以能拍成经典，是因为有周星驰的缘故
1.0, 烂！为什么这种烂片第一天还能卖一亿！也许只有《大话西游》这个名字值一亿。其他……
1.0, 垃圾
4.0, 还行，笑点不多，剧情基本算圆了，有个疑惑，刚开始至尊宝既然已经回到500年前，他为什么不认识白晶晶。
1.0, 满怀希望去看！却失望透顶，两位主演的演技和前主演比起来兼职天壤之别！特别是唐嫣的紫霞仙子，看着满满的尴尬，跟朱茵的差了十万八千里！没有对比就没有伤害！
1.0, 大话西游早已完结  就算写续集也不该是刘镇伟来写
3.0, 感觉就是去电影院重温了把<一生所爱>
5.0, 我觉得脑洞不错，我喜欢青霞和六耳猕猴还好他们he了
4.0, 虽然没有星爷的大话出彩 但却是还是西游的风格 唐嫣的青霞和六耳猕猴值得回味 吴京的唐僧和达文西一样絮叨 唯一韩庚的至尊宝实在是个败笔  还不如让邓超演更好些呢 不过影片还是值得看的 不像一些人没看呢就乱评1星 我评个4星绝对是肯定导演的续作 虽然主演没找好
1.0, 很失望、
1.0, 我可以打负分么？这么多演员都比不上周星驰，朱茵。猥琐的电影。
1.0, 想给0分，韩庚败顶了吧？明明一点不好笑  很尴尬，都是老段子一点看点都没有，女主比较适合演玛丽苏电影
1.0, 刘镇伟真是赤裸裸的啃老本啊
1.0, 没演技没剧情前言不搭后语
1.0, 毁童年……
1.0, 不想评价，看完像吃了苍蝇一样！这一星是给莫文蔚和阿娇的。
5.0, 好像应该看过才有资格打分吧！我看完归来，全场爆笑的次数远高于这两年看过的其他几部喜剧！韩庚和唐嫣对几个不同角色把握的也挺好的！
1.0, 我只想问紫霞为什么变成了黑山老妖
4.0, 诚实的说 没有看过前两部 虽然有些笑点比较僵硬 但是有几个片段真的很戳人 唐嫣的紫霞 她古装有个白衣造型我很喜欢 蛮仙的 看电影并没觉得戴美瞳了啊 那场哭戏让我记忆深刻 但是台词功力还是得继续加强 这点必须得说一下 电影的特效绝对不止五毛钱哈！影片后半部分比较紧凑。
1.0, 能打负分都特么想打负分了，什么玩意儿啊。毁不毁经典就不说了，真特么毁三观啊。编剧和导演吃屁了吧。。。“刘镇伟”这个牌子可真是臭了！
1.0, 毁经典啊
4.0, 路人觉得还是可以的，青霞的梗不错
1.0, 一个小偷，一个老女人，导演怎么选人的，看后台背景吗
1.0, 给一星是没有零星！尴尬的演技毁经典！
5.0, 很赞 喜欢青霞和六六
4.0, 二十年后当经典再次搬上荧幕，我们不能再以当年的眼光来看待这部大话西游3，时代在进步，审美在变化，不变的是原班人马带着他们的大话情结，为我们讲述一个全新的大话西游，从制作团队演员班底，前期宣传以及影片预售等情况来看，真想走进电影院去一探究竟，弥补二十年前没能看到美好结局的遗憾。
4.0, 大话3终于给大话系列画上了一个圆满的句号，刘镇伟的电影风格很别具一格啊，无厘头里隐藏着很多复杂的剧情，看多几遍才能领会得到。选的男女主角都很不错，演技在线。值得看！
5.0, 刚看完首映场，唐嫣给我的感觉是惊喜、惊艳和感动。前半部分的搞笑展现出了紫霞俏皮可爱的一面，后半部青霞和六耳猕猴的感情是真真感染到我了！紫霞青霞人物切换自如 感情表演很到位👍韩庚的至尊宝演的也很好 还有满满的亮点唐僧！还会再刷的☺️大家中秋一起去看吧[给力]
3.0," 没有对应好情节
有时台词略迷醉
青霞六耳篡位
演技仍需提升

但最重要的是：
大团圆结局，却找不到从前那种情感

笑点还好
特效还好
中秋观影，也算庆祝节日
某些片段有星爷与朱茵的影子，莫名的感动与怀念

无论褒贬，谢谢剧组，让我找回一些当初的感觉
怎能忘了西游？"
5.0, 好
5.0, 同一个故事，不一样的结局，不一样的紫霞，不一样的青霞，很不错
3.0, 影片特效非常赞！剧情风格延续了刘镇伟式的无厘头，唐嫣的演绎非常好，紫霞青霞分分钟无障碍切换，演技在线，真如导演所说，把前两部里面所有的伏笔都一一解开了，看到最后会有一种原来是这样的感觉，我喜欢这部大话西游3！
1.0, 呵呵，毁经典垃圾片，只是特效好看点，其他的演的太假!！
2.0, 真是没有最烂只有更烂，不光剧情让人无法观看，主演的演技太刻意搞笑了，张瑶挺出彩，票房过亿不知从何而来。
5.0, 出于对经典近乎无脑的推崇，无论改编成什么样，看过后理所当然的会认为就是这样……
1.0, 光看演员阵容就知道是年度烂片😑
4.0, 六耳猕猴和青霞的爱情故事让我动容，自己也是总是被这种爱情感动啊，一把年纪了还少女心不减。青霞最后的牺牲也是映证了歌词“相亲，竟不可相爱吧”。
1.0, 请玩手机的观众把亮度调低点，吃爆米花和闲聊的观众稍微小声点，大家共同维持影厅秩序，不要打扰到还在影厅睡觉的观众，他们花钱买睡眠不容易！
