1.0, 唐嫣和朱茵之间的距离得用光年计算吧
1.0, 韩庚到底知不知道自己是零！演！技！唐嫣到底知不知道自己根本没有观！众！缘！世风日下啊，各种妖魔鬼怪出来辣眼睛，好好的做花瓶骗脑残小学生不好么，电视剧都演不明白还来演电影。
1.0, 有同学在里面做过后期，跟我们咆哮说：你们要是去看这片子就是对不起我!!!
1.0, 心疼莫文蔚，何苦来趟这摊恶心的脏水。
1.0, 奇葩的阵容，一个是民大小偷，一个是中戏之耻，好好笑
1.0, 美瞳锥子脸，高颧骨苹果肌，龅牙外翻唇，大龄傻白甜，做作渣演技，这是紫霞仙子被黑最惨的一次。
1.0, 史上最丑紫霞VS史上最猥琐至尊宝，你选哪个？
1.0, 刘镇伟在选择韩庚和唐嫣的那瞬间，就注定了这是部烂片。
1.0, 朱茵只需微微动一根手指，就可以打的唐嫣满地找牙。送她八个字：不自量力，自取其辱。
1.0, 这个紫霞有点丑
1.0, 用十二个字总结：毁经典（整体），辣眼睛（韩庚和唐嫣的演技），什么鬼（剧情），想不开（莫文蔚）
1.0, 粗制滥造的特效，配合毫不用心的内容情节，看着唐嫣和韩庚分分钟出戏的演技，和那个跨时空的美瞳，duang   duang    duang。整部电影就是部弱智小学生电影。也是醉了
1.0, 打一星都嫌多。朱茵演紫霞时24岁，唐嫣快34岁了吧 不仅颜值比不上朱茵 演技更相差甚远。
1.0, 尴尬癌要发作了，剧情尴尬，表演尴尬，桥段尴尬，特效尴尬。据说刘镇伟现在在专心拍网剧大话，嗯，别拍电影了。
1.0, 圈钱的电影，韩庚和唐嫣演技尴尬到无法形容，真真是毁经典。
1.0, 看唐嫣那僵硬的肢体，那装逼的演技，我只想说，能退票钱吗
1.0, 我实在看不下去韩庚夸张并急促的演技，还有吴京，这个唐僧真土逼！唐嫣，不要以为我没提你名字就完美了，你演技最烂。
1.0, 庸俗＋低俗的消费IP之作。
1.0, 原来的班底，却是这样的两个主演，失败，失望
1.0, 即使抛开演员不看，整部电影也是处处充斥着低劣和庸俗之感，何况2位演员的身上全然不具备前作主演的灵气。刘镇伟这厮拍片之前一定在想“有王晶的《澳门风云》给我垫底，我就拍个《大话西游》续集也没啥”，事实证明，刘镇伟还是太高估自己了，这依然是一部非常合格的由IP、粉丝和水军撑起来的烂片。
1.0, 如果上天能够给我一个再来一次的机会，我想对你说，有多远滚多远。如果非要给它加个期限，我希望是forever。
1.0, 一部炒冷饭的圈钱烂片，两个演技被抽空的主演。让人心有余悸的演出。
1.0, 不能算狗尾续貂，应该是狗屎续命。
1.0, 大陆并非没有好演员，只是放眼望去尽是劣币驱逐良币，于是让韩庚唐嫣这种三流low货一次次恶心观众。
1.0, 刘镇伟不但恶心自己，还恶心周星驰，恶心王家卫，恶心所有人
1.0, 看到一半我就退场了！耿耿于怀之际，找家网吧包个厢。静静的看周星驰版！
1.0, 什么时候龅牙大龄傻白甜能不祸害电影圈啊，哦不过这烂片倒是和大龄傻白甜配一脸。
1.0, 论演员，这批演员和之前原版的演员相比，无论是实力还是气质，或是好感度，相隔十万八千里，毫无灵气和韵味，尤其是一笑百媚生、绝色倾城的朱茵之紫霞，无法企及。论制作，粗糙低劣、恶俗肤浅，无新意无内涵，也就无欣赏和思考的必要。大话西游之经典，带上这样的相关，真是可悲。
1.0, 40%的水军，一目了然。（目前跌至25%）
1.0, 毁童年系列
1.0, 事实证明，在没有期望的情况下，还是吐了。韩庚对打星爷，唐嫣对打朱茵，对对对，我们都欠刘镇伟一张电影票，黑人问号脸？！（说特效是你同学的那位同学你过来......替我问候一下他
1.0, 隔了十几年的冷饭又拎出来炒，我心目中的至尊宝和紫霞只有星爷和朱茵，仿冒品拜托别再出来污染眼球，辣眼睛。
1.0, 剧情完美，演员演的各有千秋，特效满分，背景音乐大气感人，简直是经典重现（每条5毛，括号内删除）
4.0, 感觉效果比我想象中的好😂青霞和六耳的感情线很有看头。唐嫣没有戴美瞳好评。片尾曲挺好听的。
4.0, 以为刘镇伟想炒冷饭炒到晚节不保，结果看完发现他是想证明自己还没有江郎才尽。演员的灵气还差一点，但是不至于出戏，青霞和六耳猕猴的线挺抓人的，本来只想打一星，但觉得乱打一星的人太多，打个四星平衡一下。
1.0, 莫文蔚演太浪费了，唐嫣一点不像紫霞，韩庚的至尊宝也只能呵呵了，不知道哪来勇气拍的，应该把电影名字改下，
1.0, 其实唐嫣应该演个哑巴 预告里台词太烂了。。。
4.0, 比预料中的好看，吴京的唐僧很惊喜，韩庚也蛮帅的，喜欢唐嫣的哭戏，作为国产喜剧片，还是给我蛮大惊喜的
1.0, 0分！差点看疯！烂到天崩地裂，烂得令人发指口吐白沫！太可怕了！得有多不正常才会拍出这么个稀巴烂的东西？表演、故事、台词、特效，真的，没有一样能看的。如果你实在想不开，如果你真的很想恶心自己，如果你不怕眼睛被辣瞎，再考虑去看吧。否则还是建议离这坨屎远点，别让拉屎的人笑着看你吃屎！
1.0, 大话西游之没有3。大话西游3的演员全都用实际行动证明了他们不如大话西游1和2的演员，刘镇伟也用大话西游3向观众证明了大话西游1和2有他没他根本不重要！
1.0, 丢香港导演的脸，丢西游的脸。
1.0, 首映日一大早水军就来工作，一水的五星夸的好尴尬，只想问一句脸疼吗？哦不对，脸疼的前提是要有脸。
3.0, 到底还是原班人马能找回当年电影的味道，刘镇伟还是很能与时俱进的，电影里的网络流行词很多，而且用的特别到位，简直有穿越到现代的感觉。这种混搭尤其搞笑。
1.0, 紫……霞？紫瞎吧。
0, 水军要点脸好不好！！！！
4.0, 特效这次真是到位了，尤其是后半场特效 镜头很集中，而且是五块的特效！坐在电影院里看牛魔王变身，真是很爽
3.0, 喜欢电影的可以去看，我已经替你们鉴定过了，完全可以找到当年两部大话西游无厘头的搞笑风格。唐僧这次是搞笑担当啊，金句频出呢
1.0, 比起唐嫣和朱茵的距离，分明是韩庚和周星驰的距离更大。拒绝承认这是至尊宝。
1.0, 光是至尊宝空中抱着穿红衣霞帔的紫霞的那张海报的恶趣味已经足以让人望而却步了……有种心里的白月光被人糊屎了的感觉……韩庚、唐嫣，我说这话并不是针对二位…………而是针对整部电影的所有创作人员（尤其是导演）[doge]
3.0, 兰若寺中没有了女鬼，钱塘巷里没有了青蛇，石塘咀也没有了如花与十二少，看着依旧喧嚣闹腾的《大话西游3》，只是觉得眼不见紫霞，眼不见至尊宝，这盘丝洞中只剩下了白晶晶，她好孤独啊。
1.0, 继大话2后3明显的至尊宝脱胎换骨了，褪去了成熟和玩世不恭变成了奶油小生，紫霞仙子没有了飘逸灵动变成了傻白甜，这叫人怎么能忍
4.0, 当初看预告就被六耳猕猴和青霞那段吸引，果然有戏，小痞子和高冷系女神的互动太戳老夫少女心了。
1.0, 星爷会怎么想？很悲凉
1.0, 最该吃药的是导演。神奇的是无论你有没有前两部《大话西游》的知识储备，看完后都会一脸懵逼。遥想当年葡萄和墨镜王的夫唱妇随，只觉时过境迁。大写的尴尬，尴尬的笑料，尴尬的演技，尴尬的特效，尴尬的爱情。刘镇伟正在成为下一个王晶的路上狂奔突袭。
1.0, 刘镇伟抢在冯小刚之前使用了圆形画幅！
5.0, 什么是命呢，人定胜天是故事的主题。但最后每个人又屈从于命运，真是造化弄人，令人唏嘘。
2.0, 我是要完蛋了…明明觉得剧情台词人物都尴尬得不要不要的，但是再也没有以往看烂片时会不自觉产生的焦虑感，然后玩手机…我非常心平气和的看完了…还给了两颗星！
4.0, 看的粤语版，居然觉得很不错，笑了也哭了，六耳猕猴剃毛灯芯点灯那段莫名地感动
2.0, 2.9星。1.全程懵逼脸“这个角色为啥要这样做啊”，编剧逻辑喂狗。2.猴子唐僧山寨原版令人发指，原版紫霞俏皮这版在装傻。3.非主流红孩儿是《火力少年王》来客串的？4.阿娇压不住春三十娘，唐嫣也压不住莫文蔚的气场。4.这片子主角是六耳猕猴和青霞么？5.唯一让我笑了的梗竟然是“青霞和秦祥林”。
1.0, 唉，都是些什么啊
1.0, 美瞳出品 诚意圈钱
0, 不想说什么了，阿德虽然你请我看了这部电影，但我真的像吃了屎一样难受，求求你不要再强迫我看这些鸡巴了
5.0, 对韩庚、唐嫣的表演我给五颗星，特效还有提升的空间，吴京很出彩，重新塑造了一个新的唐僧，比刘家英版要帅很多。
1.0," 原本是看追凶者也的，放映机坏掉了被迫看这个，换的还是4D厅。有个镜头:韩庚演的劣质孙悟空对着屏幕放屁（致敬仙履奇缘），然后椅子上的水雾随着屁一起喷到在了我的脸上！还有，天兵天将围剿最终boss的场景……好像一群苍蝇围着粪便在转哦
0分！！！！！"
1.0, 星爷会踏着七色彩云来取......这个......紫霞......的......狗命
1.0, 把真假美猴王的辩论拍出来解释紫霞死之遗憾，还是有那么一点点新意的，然而也仅限于此了。如果说韩庚表演僵硬的话，唐嫣简直就是糟蹋了紫霞，一张口就让人想捅死她。牛魔王和牛香香最后兄妹纠缠的戏份超级恶心，只有打酱油的莫文蔚和阿娇人设正常。可就是这么一破片，靠贩卖IP和艺人又赚了大钱！
5.0, 有人认为孙悟空不能谈恋爱，是对原著的不尊重。但在我看来，吴承恩在这部小说中尊佛抑道难道不是对道教的不尊重？真是的，只要作品好看，达到了观众的期待望，在艺术上又有所建树就足够了，我们不能要求太多。
2.0, 【C-】居然在国产片里同时看到了男同性恋，女同性恋，异装癖，性倒错。刘镇伟厉害！拍了部LGBT宣传电影！
0, 观影体验有点像有个初恋未完结，拼命回去找他，发现他还是那么蠢，还有了肚腩，正在靠出轨拯救自己的中年危机。但你们见面后还是滚了床单。
1.0, 天呢噜，所谓的西游，这部电影的各种人物之间完全看不出有感情……刘镇伟终于毕其功毁了至尊宝，一生所爱……韩庚这种二逼脸也能拽拽的当偶像，狗眼已瞎
5.0, 看到很多孩纸在吐槽换了演员就毁了经典，电影艺术还是往前在发展，剧情是经典就行了
1.0, 呵呵呵呵 想到会很烂 但没想到这么烂！
5.0, 三个词来概括这部电影，有喜剧，有爱情，有深度，是9月份难得的一部佳作，喜欢《大话西游》系列电影的观众一定不要错过。
1.0, 哈哈，水军来啦
1.0, 麻痹，太可怕了，不戴眼镜已经够可怕了，戴上眼镜看到3D五毛特效就更可怕了，台词水，表演水，配音水，故事水，连个基本的节奏都没有，感觉就像几个网大拼接在一起的，段子也太老了点，刘镇伟你真是史无前例的裱碾！
2.0, 2.5星吧，不知道炒冷饭还能炒多久。但这一部的确还有些梗挺好笑的。
5.0, 感觉唐嫣的紫霞扮相还是挺美的，只是气场上比朱茵要小一圈。朱茵版紫霞有点儿霸道，唐嫣版紫霞更小女人。
1.0, 看不都不想看，直接一星，别毁了经典
5.0, 看过第一版粗剪，深深地觉得新时代需要新的大话，这是
1.0, 不错不错，憋了20年，拉出一坨翔……
4.0, 古装电影感觉举步维艰呀，不过这部电影唐嫣的紫霞竟然惊艳到我了，有灵气，颜值高，真心美。总体来说还是不错的，既然有经典在前，后人也就是投入去演绎，展现自己的作品啦。。
1.0, 刘镇伟是雄心勃勃想复刻经典，还是死皮赖脸啃老本，从他找的两个主演就可以看出来行骗成本都快掏不出来了。
5.0, 唐嫣真的好美，她不同于朱茵那种仙气的美，她是一种痴情、执着，似邻家女孩般得美，糖糖果然没有让我们失望。
5.0, 在这个拼颜值的年代里，《大话西游3》的阵容绝对上乘啊，比起前两部那简直一脚登天啊，哈哈~
5.0, 关于牛香香爱情那段明显是借鉴梁祝啊，真是被刘镇伟的想象力深深得折服，还有阿凡达、杰克逊的元素，让人笑出腹肌！
1.0, 没看 ，但是确定很烂 ，不管是从导演到演员 ，尤其是导演真没见过这么无耻的导演，无耻到下作的地步！骗子！我就是来拉低分数的能救一个是一个！
1.0, 笑点全集中在唐僧吴京上。其他？额……呵呵……
1.0, 【F】14年，刘镇伟已经14年没拍过豆瓣评分6分以上的电影了啊。所以别再鬼扯“经典前作导演回归”之类的屁话了，就算他突然回光返照，有韩庚+唐嫣+何炅的电影，也是绝对是负分。莫文蔚的作用是证明这还是“大话西游”，吴京究竟来趟这浑水干嘛？我只想知道，星爷看了这电影，不知作何感想？
1.0, 我为这部电影付了30元大元，现在很心疼。
5.0, 原来春十三娘是阿娇啊，她和莫文蔚还真是CP感十足呢，这对欢喜冤家为整部电影添加了不少笑料，如果阿娇戏份再多些就好了。
1.0, 上映前就能猜到是部烂片，现在看评分，我又猜对了！
1.0, 《寄生兽》审查不通过的食脑虫居然让这厮夺了去，何德何能？刘镇伟妄图用来补上以前没填上的剧情坑，可现在玩的却尽是些令人尴尬症频犯的东西，别再玷污“后现代”这个词啦。六耳猕猴和青霞生下了唐僧，整部戏居然跟孙悟空半毛关系都没有，影院全程无笑果也是I服了YOU。
5.0, 比《西游降魔篇》个人感觉要更喜欢这个，这是一部纯粹的喜剧，有完整的故事架构，在特效上做得也不错，不像降魔篇那样暴力血腥。
3.0, 来说句真心话，因为预期实在太低，看完片后发现还不错，笑点也挺足的。唐嫣也能不那么傻白甜。剧情太过无厘头了，但又好像解释了很多1、2部里的情节。不知道到时候西游记研究协会会不会出来指责这部片子😂😂😂还是值得进电影院一观的
1.0, 唐嫣的台词功力真是。。。
1.0, 糖腌菜紫虾仙女
2.0, 丈二和尚摸不着头脑
1.0, 替主演们羞耻。。。。
5.0, 电影院看得很欢乐，有笑点有泪点，当《一生所爱》这首歌播出来时，好多影院的观众跟着唱，这还是我看电影第一次遇到全场合唱。
1.0, 我只是大一⭐给大龄小偷
5.0, 看得出刘伟强的精气神一点都没有老，无论是硬件和软件，《大话西游3》的卖相都还那么成熟和坚挺，也终于让这系列有了不错的收尾。
1.0, 韩庚丑八怪！！！
1.0, 导演是哪里来的勇气，敢请韩庚演至尊宝
1.0, 我是来平衡一下水军的
1.0, 水军占领的太快，我来均衡下。另外，打五星能给多少钱？
1.0, 骂它都觉得抬举它了
2.0, 挺烂的，但是也没烂到评论区里这么不堪。至少刘镇伟搞了这么一大摊子来解决影迷们对于紫霞之死20年来的耿耿于怀，还是颇令人唏嘘的。如果这是一个同人化的作品，那可能还是及格的。但刘镇伟的尴尬在于，当年他开创的故事，因为被星爷光环笼罩，反而连他自己都无权续写，也挺可怜。
1.0, 尴尬症犯了 从头至尾随意去厕所
1.0, 我没去看，不不想看，点进来就是想说句谁看谁傻逼！
1.0, 这不是IP，总拍续集是吃老本的自己作死。
5.0, 唐嫣美美哒，这版紫霞仙子比朱茵版的欢乐不少哈，太逗了。。。哈哈哈。。。
5.0, 唐嫣演的紫霞仙子太漂亮了，唐嫣自愿嫁给牛魔王，简单太有理想太有报负了。也倒是，再怎么说牛魔王也是牛人一枚啊！更何况牛哥长得还挺帅！
1.0, 这个导演不把这IP拍死不罢休
3.0, 唐僧是六耳猕猴和青霞生的！！！父母最后全裸在灯里守候！吴京不仅顶着牛在悬崖边狂奔，还抱着琵琶同大家飙歌《一生所爱》，牛魔王被妹妹吃了，还变成巨怪兽，天兵天将来袭击，刘镇伟再次在九道轮回里证明他还是那个编剧技安？品质究竟如何？观众会用脚为它投票！
1.0, 不要以为粘上几根毛，拿个铁棒，你就是孙悟空了！啊呸，吔屎啦！
5.0, 果然还是那个味道
5.0, 暑假档没一部现象级大片，现在开学了，《大话3》终于要上了，看好这部电影票房，一扫时下电影市场的颓势。
0, 负分滚出！《六耳猕猴与青霞的爱情故事》，全片最厉害的是哪吒他爹，牛的妹妹是蛇精，唐三藏是猴的种，白晶晶和春三十娘是lesbian.哦天哪！
5.0, 这片的导演或者编剧换成周星驰，只需要一个名字，全片都不用动，分数起码高两分
5.0, 片中紫霞仙子对战白晶晶的动作戏，那种静止慢镜头，完全是在向《X战警》的快银致敬啊，刘镇伟真是香港导演里除徐克之外的最大鬼才啊。
5.0, 还是挺好看的，搞活动买的，10元一张票
5.0, 你们确定六耳猕猴也是韩庚演的？确定没有用替身？我怎么一点儿也看不出来？到底是化妆太骗人，还是韩庚演技太好？
1.0, 同事一定要去看，看完后她不说话了。电影没啥可评的，我就想知道莫文蔚为啥要参与进来，哎……
0, 要不是有“一生所爱”这首歌，我特么根本不会抬起眼皮
5.0, 刘镇伟走出了自己的一套独立的电影美学，他向所有观众证明了那句：搞笑，我们是认真的。看好这部《大话西游3》入选2016年度十佳电影。
1.0, 如果有月光宝盒，我相信更多的人想穿越过去阻止刘镇伟不要做这件傻逼的事。侮辱自己一点都不好玩。就好比一个文采平庸的人突然写出了一部佳作，然后20年他靠重复自己模仿自己甚至是操自己来寻求关注，很不酷甚至很该死。
1.0, 足以写进教科书的一部烂片
5.0, 虽然没有了星爷，但片子仍然好看，
3.0, 原来这故事只是把孙悟空和紫霞的事移到了六耳猕猴与青霞身上。故事编剧还是—技安，真是让人脑洞大开。除了特效糙些，娱乐性还不错，故事也算能自圆其说。黄征演的玉皇大帝真是个逗逼。
3.0, 喜欢人物细节无处不在的完整感，在习惯了瞎人眼的特效和演技，习惯了不连贯的突兀的故事叙述和人物之后，这次刘镇伟不算特别讨厌。天书写错和新一对cp的设定也算是煞费苦心。可是完成度太差了。论港片的没落，资源全萎缩。
4.0, 其实还可以的啦，虽然没有前面经典，但是也还可以
1.0, 辣眼睛
1.0, 韩庚毫无演技，唐嫣相当尴尬，剧情瞎搞又不好笑，毁童年系列，求别再让烂片消费情怀
1.0, 如果你看完给了差评，那你也怨不得别人。这片，谁看谁傻逼！
5.0, 谁说打星就不能耍嘴皮子，吴京不仅功夫了得，演技也是一级棒哈。虽然没有“only you！”原唱罗家英那么“辣眼睛”，却同样搞怪搞笑无极限……
5.0, 对韩庚总是那么没抵抗力，他的帅，他的才华深深折服了我，他的表演成功撑起了整部电影，看好他会凭借这个角色拿影帝。
1.0, 导演刘镇伟跟编剧技安都可以去死了，有着想靠IP捞钱的心更可以鞭尸，穷途末路的续集之作，消费经典糟蹋回忆，屁缝中拼凑出来的剧本，依然兜兜转转的在原地踏步，一群毫无灵气的演员用蹩脚的复读技能又磕碜了一遍所有前作经典对白，那冰冷尴尬之感能窜遍整个影院，赤裸裸的侮辱了一把“大话”影迷的智商
3.0, 纯粹恶搞经典，当填空乐子看看也不错。
3.0, 大话西游三证明了刘镇伟的重要性。同样也证明了周星驰的不可替代。真正的喜剧的内核是悲剧。刘镇伟全片铺设笑点，做到了无厘头。而周星驰做到这却是把无厘头变成了真内核，真悲剧。当两个至尊宝同说出  他好像条狗啊！ 的时候就注定和大话西游12是不同的片子了。
5.0, 牛魔王真的好帅，比陆树铭版要出彩太多。话说，牛魔王都可以是帅哥了，让我们这些屌丝还怎么面对人生……
1.0, 有韩庚就该知道
1.0, 看电影的时候我非常担心唐嫣的脑门会戳破荧幕，韩庚的演技也是一如既往的尴尬。这版大话西游戳不中我的笑点，果然，没有星爷的大话西游只不过是“大话西游”而已。
3.0, 为了情怀～最喜欢的点是牛香香和螳螂精的爱情，没有大粗长的狂野，却有短而精魅惑。只那么几个镜头，就把梁祝的故事给颠覆了，很好很污。
1.0, 我从来也不是大话西游的铁杆粉，但我不否认这个作品的经典地位。我就想问问你们二位主演：觉得自己何德何能，敢接至尊宝和紫霞？你们真觉得自己会侥幸不挨骂么？
2.0, 当然知道这是在低级烂俗喜剧和贩卖情怀的套路，但还是冲着《大话西游》这个名头走进了电影院。其实心情很复杂，一个六十多岁的老导演要靠吃老本来养老；一个被拍烂的题材遭到了恶意的翻拍；一群演技都不在线的演员喊着致敬经典；一个被奉为后现代主义经典的爱情悲剧要被强行圆成一个大团圆的结局，尴尬
4.0, 这一部，给了所有人一个完美的结局。紫霞有了她的真挚爱情，至尊宝也不用戴上紧箍咒。只是如此，他还是那个盖世英雄吗？有句话说「陪你喝醉的人注定不能送你回家」，所以，他也不能即是盖世英雄，又是你平淡的爱情吧。不完美才是完美，大话西游该有的结局，还是那句话，「那个人，好像一条狗啊」。
1.0, 好好一部戏，至尊宝和紫霞成了插科打诨的路人，配合青霞和六耳猕猴一会演绎无厘头的烂剧，一会演绎黑社会和阿飞正传
5.0, 硬要说20年前两部《大话西游》有什么遗憾的话，那就是以一个悲剧做结尾了。估计刘镇伟也是听到大家心声了。《大话西游3》的结尾不悲剧。
5.0, 莫文蔚都结婚了，这么多年过去了依然那么年轻，和前两部电影的形象并无太大差别，真是保养得宜啊，喜欢她和春三十娘的CP感，太逗。
1.0, 去你妈逼
1.0, 《大话西游3》3D：刘镇伟再这么明目张胆地骗钱，我可要报警了！他蠢到非要亲手毁掉自己缔造的经典，黔驴技穷之下只能利用原作的场景和台词进行再创造，把原本的想象空间都填满了，沦为模仿秀式的综艺剧。喜剧表演需要专业性，让这帮门外汉演员来逗我们笑，使出了洪荒之力也是白搭。提名：最烂影片/☆
5.0, 特效不错，特别是那条和孙悟空激战的巨龙，做得太令人震撼了，那种飞沙走石，那种宏伟壮观，完全是好莱坞大片的水准，值回票价。
2.0, 这狗尾续貂的结局改写真的是对记忆的抹杀，这不是悬疑片啊，人物关系搞那么乱却完全是依靠角色之口将其托出，是在搞观众么？几位主演的选角也是教科书式的失败，完全撑不起一代人心中经典的份量。既然你选了这四个字当片名，那就要对得起它。据说导演的下一部大话西游已经在路上了，我真是普你老母。
2.0, oh my…
5.0, 经典虽然难以逾越，但好IP总能带给人不尽的精神享受。《大话西游3》难说再见！
1.0, 什么烂片还害的我在影院里如坐针毡，操！操！操！
5.0, 唐嫣版紫霞很清纯，就是瘦了些让人有些心疼。喜欢她摇手铃的经典动作，和朱茵在气质上真是傻傻分不清楚，难怪至尊宝会那么喜欢她。
5.0, 影片中那首《一生所爱》真是经典啊，瞬间将人拉回到了曾经的记忆中，为了这首歌，为了那些错过的爱情，必须二刷。
2.0, 致敬须谨慎，续貂或败笔。团圆无意义，圈钱莫装逼。
1.0, 唐僧居然是六耳猕猴的儿子，好久没看过这么尴尬的电影了……不断刷新的年度最烂记录
4.0, 看到玉皇大帝都这样坑，我决定一定不能放过我马虎的儿子一马，真怕他将来范大错呀，玉皇大帝真是教育孩子很好的反面教材呀
1.0, 小号被水军盗号，目的是为打五星。所以我愉快地用小号大号给你一颗烂星。
3.0, 看了电影，找回了大话的感觉，还是那么无厘头和恶搞，相信也会成为大家议论的焦点和经典。唐嫣的使命也算完成了，青霞和紫霞演出了两种完全不同的味道，尤其是青霞更出彩
1.0, 唐嫣是我最不喜欢的女演员没有之一，欣赏不了这位的颜
