0, 怎么可以 这么 难看
1.0, 演员的演技太烂，
1.0, 天哪……我真的不知道该说什么。
2.0, 只想说接这个剧真的挑战很大，全程不知道在诠释什么，用朋友评价的话是神的东西不是你们这些凡人能懂的
3.0, 中秋和两个好朋友看月光宝盒，总是还差一个
3.0, 韩庚总有模仿周星驰的感觉、
1.0, 不知所谓
3.0, 其实也还好啦。唯一想吐槽的是国产电影为啥那么短？票价还跟比之长半个小时的一样贵？
1.0, 第一次去杜比影院啊 看的这片啊 这片啊 啊
1.0, 我是来给差评的～
1.0, 好烂的片子，紫霞好丑啊，一星都嫌多好吗！
2.0, 最后的情怀炸光了，有点后悔看了电影，还不如让原来的影片记忆继续留在心中
1.0, 唐嫣的演技还是一如既往的尴尬，和美丽灵动的朱茵比，她就是个紫霞的低配版。导演炒冷饭黔驴技穷了，大话的IP水准越来越低，给他一分是为了星爷与大话以往的情怀，同时也是鼓励吴京的演技。
2.0, 编剧去吃屎吧。叫什么技安，怎么不叫胖虎
5.0, 红孩儿居然这么成熟这么帅，简直要把人看呆了。
1.0, 没错，唐嫣应该演个哑巴！！台词分分钟出戏！！
1.0, 烂。
1.0, 呵呵
3.0, 明明还过得去，我想说那些打一星的，是不是碰了豆瓣圣（G）片（dian）就受不了了？
1.0, 什么辣鸡玩意儿
1.0, 不知道怎么说乱七八糟 没剧情没演技没笑点
1.0, 想无，全想无！不知拍这电影的人是不是大脑有坑？？
2.0, 狗尾续貂恶搞尴尬，青霞那对比紫霞那对讨喜，另外女主是配音了吗...怎么听着怪怪的
3.0, 刘镇伟借着特效应该是拍出了他最想要的西游记吧 可惜这不是大话西游 强加感情戏差太远
2.0, 前部太经典了。。。所以这部。。。
3.0, 这个紫霞仙子有点丑，这个至尊宝有点挫
5.0, 白晶晶和春十三娘竟然是一对儿。刘镇伟太调皮了。不过莫文蔚和阿娇演的，还真有点儿攻守兼备的意思哦
1.0, 一枪杀了我吧
1.0, 狗尾续貂
1.0, 什么时候才能打负分呢
1.0, 哈哈
2.0, 主演的演技？看不下去啊。
1.0, 说个笑话：唐嫣
5.0, 我觉得真的能做到这样不错了
2.0," 真的是对前两部的侮辱。
红孩儿的头发真的是红色的，还有陀螺，真是醉了。"
1.0, 毁了我心中的经典
1.0, 什么玩意⋯⋯
3.0, 我看的还行吧
1.0, 至尊宝辣眼睛
1.0, 本人并没有周星驰情结，大话西游也看过，并没有多喜欢，反倒喜欢东成西就这样的惊艳之作。但不得不说朱茵版的紫霞仙子真的灵气逼人！看大话3纯粹是因为进电影院的时间点没得选了，只能看这部！看完何止一个悔字！韩庚唐嫣的演技分分钟出戏！
1.0, 剧情完全被篡改，经典永远无法被超越，就乱拍吗？真是不想吐槽
1.0, 大话西游我只认周星驰！是周星驰成就了大话西游，不是刘镇伟。导演歇歇吧，不要再毁经典了
1.0, 刘镇伟已不是当年的刘镇伟
1.0, 判断烂片的标准，有些人的名字就是避雷针
2.0, 原来唐僧是六耳猕猴和青霞的儿子。。。wtf (黑人问号.jpg)
5.0, 这部感觉是主打特效的，当然了剧情也是很复杂，很令人惊艳。完全与之前的大话西游都是不同的，紫霞穿越了！
1.0, 讲个笑话，唐嫣的紫霞，韩庚的至尊宝。[笑cry]丑，辣眼睛，他妈怎么看都是刘镇伟江河日下炒冷饭圈钱之作[生病]冷饭炒多了会搜的。
1.0, 对不起大话西游这几个字！
1.0, 又一部消费ip的电影，生堆硬砌的笑点，大量出戏的剧情，不知所谓的模仿，完全看不出来。唯一的主题大概就是只要我爱的人过的好，无论自己怎样都无所谓，主角的转移也真是自然，六耳和青霞就这么自然而然的上位了，哎，真不知道电影讲的什么玩意
2.0, 什么鬼= =ㄖㄙㄖ‖
2.0, 所以六耳猕猴和青霞才是主角？所以唐僧是六耳猕猴和青霞的孩子？所以最后去取西经的是六耳猕猴？所以《大圣娶亲》里死的也是青霞？所以片末的夕阳武士才是至尊宝？所以刘镇伟说的“所有答案都会在3里得到解答”就是这样？脑洞很大哟
1.0, 烂到令人发指，所有演员都毫无演技。做作，傻白甜，恶心，5毛特效，毁经典
1.0, 毁我经典，什么破玩意，去看的人都特么智障吧。
1.0, 嗯！不好看
1.0, 毁了大话西游系列。刘镇伟你记住，大话西游系列的情怀不在你，在于星爷！！！
1.0, 额！！！
1.0, 我为40块后悔
2.0, 可能远离了周氏无厘头，远离了以往胶片的质感，远离了爱你一万年。难道只剩一生所爱？
2.0, 呵呵了，只能这么说
1.0, 一星都不想给
2.0, 2星给的不全是演员，还有这个剧情，看得我满脑子问号，不停的在整理思绪，整的还是看不懂
1.0, 不会有4了吧
1.0, 看你们都在说唐嫣  韩庚不服  烂演技加丑  他跟至尊宝哪点搭得上 我不懂。
0, 没看，所以不打分，毕竟这不是一坨屎，不吃就能知道它多垃圾。但是就刘镇伟之前的电影，我想说，刘镇伟透支了《大话西游》和《东成西就》一辈子。看了预告片台词很low。I服了YOU都出来了。
5.0, 看了豆瓣一堆差评 我决定给五星 因为比我想象当中好看
1.0, 终结者
3.0, 感觉被这部给毁了。。
1.0, 导演选男女主角选得挺好的，毕竟一部电影要从头到尾都烂才不用让人替谁觉得惋惜。
1.0, 为什么豆瓣没有负分？
1.0, 晚节最是难保，送给这部电影的所有参与者。
1.0, 居然去看了这部巨烂无比的片，求勿喷
1.0, 我只是想说，连预告片都烂的片子现在真的不多了
2.0, 大团圆1分，吴京1分，钟欣桐美貌1分，编剧脑洞1分，看在原著的面子上1分，爵迹的衬托1分，特效减1分，唐嫣减1分，韩庚减1分，唐嫣韩庚cp减1分，最终得分2分。
1.0, what the fuck? 狗尾续貂，尴尬的剧情，迷之笑点。韩庚演技做作浮夸，唐嫣一脸面瘫，全程出戏。 一星给一生所爱。
3.0, 其实唐嫣的装扮是过关的了，演技慢慢来吧，关键是虽然大话西游挺无厘头，但也不至于这样浮夸。
1.0, 不好看
2.0, 顶着羊头卖狗肉
3.0, 唐僧是整个片儿的笑点啊，哈哈
1.0, 颜值没有  演技没有  不知道到底在看什么  补充一句  朱茵真厉害
1.0, 不要把唱歌都唱不好的弄来演戏好嘛，尊重演员两个字好嘛。
5.0, 为了在电影院里听到一曲《一生所爱》我也是拼了，买了午夜场的票，简直太好听了，听着听着才发现居然是韩庚唱的呀。想去二刷，就为了听歌怎么地吧
5.0, 说句真心话，看了预告觉得一般，看完正片觉得还不错，笑点挺足的。
0, 垃圾 打发时间我都嫌垃圾了
3.0, 我倒觉得还好，不至于一星呢么差，唐嫣也挺美的，大家不要总带着比较的心情去观赏，朱茵的巅峰颜值没人能去打破，但不能打破不代表不能尝试啊，电影既然要拍总不能让朱茵再演吧，就只当它是一部新电影吧，刘镇伟的脑洞也是挺大的。不过真的希望刘导不要再吃老底了。
3.0, 我觉得变味了。
5.0, 劇情過關 結局不錯 笑點挺多的  最後說一句紫霞好美啊 雖然主角是青霞
1.0, 没看过，光看阵容就想拉低分数，有0星就好了~为了圈钱也是没底线了！除了抵制票房我们还能怎么拯救中国电影
1.0," 给一分都嫌多。
完全是一部骗钱的电影！"
3.0, 期待值很低，并不是烂的出奇。
5.0, 看了之后觉得意外的好，刘镇伟终于把技安的名字捡了回来，两个主演都是一人分饰两角，角色转换毫无违和感，都用心去专研角色了，演的非常棒，大话终于在我的心中划上了圆满的句号了。
2.0, 虽然有笑点。但是还是垃圾，给笑点和唐嫣2星
4.0, 孙悟空和紫霞仙子 变成了六耳猕猴和青霞仙子？
2.0," 没法入戏,违和感太重....六耳猕猴和青霞成了主角......故事可以没有章法，但如果不动人还有什么意味......"
1.0, 从来没有一部烂片让我一分钟都看不下去，在电影院里看得那叫一个睡得香，如果可以，真是一颗星都不给，以后就应该设立烂片退票制度。。。浪费时间浪费钱
1.0, 我的眼睛！
1.0, 想不到可以烂到这种极致
1.0, 能不给分吗，六耳猕猴都出来了，罗刹女会怎么想，真是糟蹋完经典，又糟蹋典故，没创意就完了，还是在毁玩经典后的继续强笑，这份“坚持烂片到底”的耐心真是没谁了
1.0, 一星，还莫文蔚一张电影票
1.0, 心疼莫文蔚、唐嫣，好想打死脑洞大开的编剧，你比战斗民族的神剧还要脑洞大开
4.0, 还是那些老梗，还没看完就犯困了。
5.0, 编剧、导演刘镇伟，主演韩庚、唐嫣、吴京、莫文蔚、谢楠、阿娇、张超、张瑶、王一博等，从主创到主演、从演技到颜值都是一等一的，不说别的冲这阵容就值得二刷。
1.0, 面对现实吧
3.0, 不要拍的这么煞笔行不行
3.0, 无厘头风格无厘头得过了，感觉就是一滩狗血。创新到颠覆了思维，也是不容易，可是眼球是夺了，笑点却不高，前传的记忆难以颠覆，可能人们更期望看到一个正常的玉帝哥哥吧，估计要是有4，观音都得被玩儿坏，这不是搞笑，是搞烂。
3.0, 佩服刘镇伟的脑洞，最搞笑的还是唐僧，红孩儿、牛魔王和牛香香太狗血了一点……最美好只有莫文蔚的白晶晶。
4.0, 还挺搞笑的，韩庚和星爷当然不能比，但也算完成任务了，唐嫣还行，某个瞬间看到朱茵的影子。过节看这样的电影，乐一乐。
2.0, 翻拍失败的经典证例
1.0, 迷之尴尬……有一段像快银的镜头，劣质的我……
4.0, 中秋合家欢型，笑点多不烧脑，3D特效也算不错啦，合格的国产喜剧！原来六耳和青霞才是主角啊。
1.0, 全程想去洗手间…
1.0, 睡的挺舒服
1.0, 负分滚粗  如果有负分  我肯定评负分
1.0, 艹
5.0, 挺搞笑
4.0, 挺有诚意的 笑点自然 人物切换处理也不错 很满意
2.0, 且不说演技和烂梗。后面我一直在想一个问题，如果六耳猕猴抱着青霞的瞬间算改了天书 天书就算写错了 也只是他们被拉入了新的轮回 特技还是震撼的 3D没错 IP即使改成老旧梗不伦不类的也不会太影响情感的表达 如果再深挖挖就好了。特效没问题 三观还没醒。
1.0, 好生气哦，但还是要保持微笑
3.0, 听到一生所爱就觉得想哭
3.0, 在较差和还行间犹豫一下，觉得高于了我的预期，所以多给一星吧。要去看的做好准备，剧情其实像是前两部的说明会，脑洞还是蛮大的。但也不难看就是，还是有些笑点的。至于男女主角的演技就忽略吧。唐嫣真是活生生把娇俏可人的紫霞演成了面瘫毫无表情。倒是吴京的唐僧还是可以的，挺好玩。情怀是没有的。
1.0, 辣眼睛
2.0, 这已经不是无厘头，而是恶搞了。实在太烂，各种炒情怀。
1.0, 看过后悔系列，神奇的圈钱💰圈，卖你妈的情怀，卖你吗的回忆！
5.0, 韩庚一面是孙悟空，一面是至尊宝，还真是很考验演技呢。从结果来看，他很好的完成了这个角色，希望未来的续集中还可以看到他。
5.0, 毫不夸张的说，第三部没让我失望，特效、脑洞、演员都是一等一的。
1.0, 把经典毁了，烂到极致！无所谓 最经典的电影还是仙履奇缘月光宝盒
3.0, 秦祥林的爱情故事…
4.0, 我觉得还是能看的。
1.0, 无语，心疼莫
1.0, 辣鸡！这种经典不要再翻拍了好嘛！不是人人都是周星驰
1.0, 刚从电影院出来，想把所知道的全部脏话献给这部电影，看到微博说为了颜去看的，are you fucking kidding me？？？谁的颜？？？
1.0, 打五星的都是水军吧？
1.0, 为什么没有负分？
2.0, 太尴尬了，整部剧真是强行笑点，很多地方我都是尴尬得笑的。最后的打斗简直是猴子加剑姬大战牛头加蛇女加扇子妈加火男，奈何你们全ap啊。唯一亮点，只能说是那首一生所爱了。在我看来，大话西游还是只有两部！
4.0, 我没看过原来的大话西游呢，直接3还是觉得好好看呢，赶紧补一下前2部，免得OUT了
1.0, 。。。我是为什么冒雨出门看了这烂片
2.0," 这片子还能打到5.7,别扯淡了！"
1.0, 毁童年
3.0, 还行吧。期望值不要太高。
1.0, 水军发一条评论能有多少钱，我免费来平衡一下吧。经典没有能力的话就不要毁了他好吧，给我们一点美好的回忆吧
1.0, 只看了预告片，不想为了专门打一星去贡献票房。
1.0, 刘镇伟晚节不保，赶紧回去养老吧，别出来恶心人了
1.0, 韩庚和唐嫣……呵呵呵呵呵呵呵
4.0, 还可以吧，虽然没有前面两部经典了。
1.0, 浪费票钱，炒冷饭，这猥琐的至尊宝真是毁经典，以后大话西游能别拍了吗，圈钱的烂片
3.0, 吴京包了整部剧的笑点
2.0, 套路情怀来圈钱的垃圾片子，全片唯一亮点只有一首卢冠廷的<一生所爱>
5.0, 这部影片彻底颠覆了我对《西游记》的印象，这样的改编很成功，相信这部《大话西游3》在票房上必将称霸9月档。
2.0, 唉，说到至尊宝想到周星驰也很正常，毕竟经典通常是深入人心的
1.0, 1分，1分也是打给莫文蔚的
1.0, 真的很烂
2.0, 没用心的圈钱之作，我还花钱看了
1.0, 剧情编的是什么鬼，原来的情义都没有了，果然是烂
1.0, 不仅尴尬。。。还很狗血。。。
0, 看完电影字幕出现了导演刘镇伟，突然感觉莫名心疼啊，这都好意思把自己名字放上去……
1.0, 烂烂，非常烂，不是跟以前的比，就跟最近的比都很烂。。。。
1.0, 辣眼睛，毁经典
2.0, 虽然我是抱着看电影有多烂的好奇心进影院的，然而......全程大写的尴尬，影院里听到的笑声也都是些尴尬的笑。大量的老大话西游的元素堆积，炒的冷饭让人如坐针毡。韩庚演的是什么玩意儿，人家唐嫣好歹还有颜看。
1.0, 两个主演都赶客，混乱又尴尬的情节让人恨不得假装自己尿急离场，忍了三四十分钟终于忍不住走了，第一部烂到让我提前离场的片子，纪念一下。
3.0, 作为普通喜剧来看还行，但如果当成大话西游的后传来看就略显尴尬，两星半吧。最后，我也想学吃人呢
1.0, 经典永远也不可能会被超越，更何况演员演技形象都这么差
2.0, 大锅乱炖……什么都往进塞，强行解释，强行美满。大团圆结局终究只是故事，连童话都算不上。
1.0, 韩庚不要脸就不说了，唐嫣接片也这么不负责，紫霞这个角色是她能驾驭的吗，活该被黑
1.0, 看到刘镇伟这三个字就可以给一星了
3.0, 虽然我笑了，但是真不知道看他的意义是什么
5.0, 玩什么不好，非要玩月光宝盒。过热后不及时降温，坏了都没处修哇。活该！
1.0, 只希望观众能更挑剔点。别因吐槽而去看烂片，这样也会少点圈钱的戏。如今能认真拍戏的人太少～
1.0, 唐嫣渣演技不提，韩庚确实只适合演个穷小子，但凡有点耍帅的，他那乡土气息都不适合，刘镇伟不说了，拿大话西游炒冷饭好几回了都，故事情节生拼硬凑到爆，陪儿子取经，和玉帝有个协议，借调到天宫，真希望这能是最后一次炒冷饭。
1.0, 不好看 很无聊 80分钟 下载看都浪费时间…
1.0, 真 好 看 ～ ～
1.0, 毁前部
2.0, 冲着粤语版预告看的。错了。以后再也不看这种乱七八糟的电影了。同场有很多小朋友看得很欢。特效还不错，但配角牛魔王一家4个太出戏。主角三个模仿痕迹较重。经典之所以是经典，是因为经典的角色是原创的，模仿怎么也达不到前面的高度。超越不了又何必重拍。中国烂片史又多一部乱七八糟的电影。
1.0, 经典党简直不可接受
3.0, 一星送给电影，再加一星送给莫文蔚，最后一星送给我女票
3.0,     只能评以平庸二字！
1.0, …为什么必须要给一星
1.0, 简直不知道乱七八糟在讲什么
2.0, 什么鬼
1.0, 唯一的亮点也许就是美的一塌糊涂的唐嫣了吧。硬拗的搞笑，烂俗的台词，各种为了烂俗而烂俗的乱入。有主线吗？也许有人会说有。白晶晶是干嘛用的，至尊宝老婆？可能比布景还没用的摆设.... 圈钱而圈钱的电影，完全没有节操和底线了。
4.0, 不和经典作比较单纯说这部，我觉得电影拍得不错，节奏合理，演员没有拖后腿的，影院里大家也是笑声不断没有出现秘制尴尬的地方，尤其是一生所爱响起来的时候被惊艳到了好嘛！对于中秋节乐一乐来说，我觉得足矣，不用太挑剔～因为害怕和敬畏高山而止步不前，是怯懦，敢于超越就值得敬佩👊
3.0, 还行
1.0," 烂片,唐嫣真是中戏之耻,一分都嫌多"
2.0, 无论如何我都无法为这些明星演技买单，演员？
5.0, 没想到莫文蔚和韩庚、唐嫣一起搭戏还是这么美，女神就是女神，岁月在她的脸上没留下痕迹。
1.0, 刘镇伟这吃老本的吃相未免难看了点。★
2.0," 翻拍大话西游2仙履奇缘。六耳猕猴取代孙悟空也就罢了，最扯淡的是，牛魔王化身螳螂哥。

你妹啊，那真是你妹啊！"
3.0, 只是好久没看电影了实在没电影看了。。哎，搞不懂-_-#@星空
1.0, 2016年最烂之片原来在这啊
1.0, 和人杀时间去看的……拍片高只好看他，看前还抱着都是一个导演不会太差的心理，看完知道我错了……去看原来的大话洗洗眼
1.0, 操你妈，听见没？操你们妈。呕
1.0, 接受不了，六耳猕猴的儿子是唐僧！
3.0, 感觉没有想象中的烂，基本是就前两部没解释清的点展开一个遵循原结局的故事，笑料虽然不多，但无厘头的感觉还是有的。男主韩庚在女主的衬托下也演技拔尖。唐嫣想要继续做花瓶还是要好好保养一下啊，毕竟年纪真的不小了…
1.0, 真特么搞笑
1.0, 哈哈哈哈哈哈哈nmsl
1.0, 这是同一个导演？？？我去
1.0, 圈钱之作
2.0, 又是一次不愉快的观影体验
0, 忍无可忍了！唐嫣演的什么鸡巴玩意儿？
1.0, 韩庚在星爷面前就是一堆屎
3.0, 刘镇伟只是想还原一个圆满结局…我决定配合着欢喜一下
1.0, 打一星的就是水军！我甘愿当水军，谁告诉我哪里可以领盒饭啊？
5.0, 颜值爆表的一部电影，不管是二十年前还是现在，没有理由不爱看啊。
1.0, 太高了
0, 看得我尴尬症都犯了！简直在观众席惊慌失措！
2.0, 临时选择看这部电影。故事情节真的不是无厘头，是混乱到不堪。景色，特效是美的，不过美的有点不合时宜。恰好演这部电影的主角都是我不喜欢的人，不过觉得里面的唐嫣相对其她平时其它角色还是算美的。
1.0, 唐森=猕猴+青霞…嘈点无极限、一星给片名还有哮天犬～
1.0, 太无语了
4.0, 看了大话三，我之前的不解都解开了！并不是喷子所说的烂片，剧情真的还可以。韩庚在我心里一直是没有演技的，但这次完全改观了~唐嫣很适合古装，不仅造型美演技也好，吴京的唐僧一开始有些出戏但是太搞笑了，还是很赞的。刘镇伟这次没让我失望，所以给4星，望继续加油
1.0, 没看过，因为号被盗了拿来打了个高分，还给我换了个恶心的头像，我来打个1星
4.0, 总体来讲惊喜大于情怀，青霞和六耳猕猴的这条线让人眼前一亮，发现并不是炒冷饭的续集，韩庚的至尊宝没让人失望，有自己一套无厘头风格，唐嫣确实适合美美的古装扮相，举手投足都让我看到了那个灵动的仙子，电影里一个人扮演的两个性格掌握得恰到好处，并不看不出刻意模仿经典（本想吐槽她，结果沦陷了
1.0, 果然……
1.0, 看了真想哭，浪费我时间和10块钱，毁经典的作品
5.0, 原来在电影的宣传期看到居然是韩庚饰演至尊宝还是有些失望的，结果看了之后发现，韩庚也真是棒棒的，居然把我心中的至尊宝演得很好，没有让人失望，看来他是下足了功夫的，或者是导演训练的好。
1.0, 呵呵
5.0, 错综复杂的关系成就了这部《大话西游3》，人物性格都很饱满，人物与人物之间的关系也都是很微妙，连唐僧都晕菜了，但是居然很好看，比预想中好看很多，感觉会成为今年十佳电影。
1.0, 我是水军，我就是要打一星！
2.0, 哎，用点心吧，搞笑的点依旧跳不出框架，创意有，但是毫无感染力。整体剧情浮夸，混乱，不知道想要表达什么。导演已经在大话西游的路上渐行渐远，经典就让它在那里吧，它很好，别去打扰。
1.0, 韩庚到底知不知道自己是零！忽悠我呢   什么玩意电影
1.0, 这种香港电影和国产烂片没什么区别了，开始觉得刘镇伟想填坑，看到后面发现更多的坑，另外，香港电影不尊重原著大家是知道的，但是佛道怎么混了，神仙体系都是乱的，又一次看到了金刚蛇身，话说上次还是封神里的范冰冰
0, 吴京很到位啊
1.0, 好久没见过这么烂的电影！！！！多一秒都不能忍！！！！炒鸡大烂片！！！！
1.0, 失望
5.0, 讲真，我觉得老韩的演技在进步啊👍昨天我为什么挑了一个那么黑暗的影院，两年没见你，还是我们萌萌的坑坑，逗比的坑坑🙊笔芯
1.0, 我真的很少很少很少在电影院睡着……
2.0, 你们千万别去看真的
3.0, 回补前两部
1.0, 看完预告就可以评分了
2.0, 好在一生所爱
3.0, 额我知道是烂片。但就还是去看了。在影院听听一生所爱也好啊。不过还是充斥着港台电影的恶趣味，这点很讨厌。ps:意外很喜欢牛魔王妹妹的那个角色啊，演员演技和台词功底很赞！另外唐嫣的脸也太尖了吧，大荧幕不好看！
2.0, 一星给吴京，一星给结局。其余的不用多说了，虽然乱得烂得在意料之中，但我高估了自己的观影能力，看完之后好难受好空虚，以后再不去影院看此等烂片。技安，你一直以来就没技。
0, 本年度第一惊悚
1.0, 自从这家伙从韩国回来，就一直凭着跟韩国爹一样姓在内地上蹿下跳，拍了几部电影彻底证明了自己的水平后，因为在婚礼几乎是猥亵柳岩偃旗息鼓了一阵，我那时就感慨，这货这回终于可以淡出大家视线了吧，结！果！这货跳出来祸害了个更大的，直接毁了我们童年的一个记忆....
1.0, 本来想抱着一个客观的态度去看的，结果再看的途中分分钟减分。特效烂你可以不做，原来的椰子多好，减一星。我是不喜欢唐嫣，但是没想到剧中一众人等的演技都是这么烂，包括莫文蔚，估计莫文蔚也是出戏了，减一星。台词，不是硬伤，直到吴京的@¥$&…减一星。红孩儿的造型将我从放映厅逼出，减一星。
1.0, 这么多人打一星，综合评分竟然超过5分，水军太多了，我要平衡下，就打个一星吧，没有周星驰的大话西游还叫大话西游嘛！
5.0, “二十年前死的人不是我。”紫霞的一句倒出了所有的谜团，这部电影之所以好看就在于有太多谜题需要一步步揭开，看到最后我才释怀了。
5.0, 进影院前，又去重温了大话西游1和2，第3部有熟悉的音乐和桥段感受很温馨，总体来说拍的不错，来龙去脉都交代的挺清楚，搞笑的功课也做的非常足。
1.0, 莫文蔚何苦来哉，难道是手机不好玩，还是月饼不好吃。
2.0, 给两颗星完全是给星爷面子。
4.0, 这次看《大话西游》这经典IP，看着不仅有情还有景，有爱更带感。
1.0, 真的是没期待去看的，可也真没想到这么烂！
1.0, 狗尾续貂
1.0, 看完电影的我有点不知所措，旁边还有一位笑出眼泪女观众，更让我不知所措，WTF
1.0, 看不下去，直接和老婆从影院出来
2.0, 唉，毁我星爷的经典。
1.0, 哎，我为啥要去看，看完釜山再来看这，，，我不想承认中国电影比棒子差啊～
5.0, 不负所望
4.0, 很久没有一部让我笑的如此酣畅淋漓的电影了  荒诞不经的无厘头  但却有着缜密的逻辑笑点
2.0, 果然经典翻拍就是在毁经典   虽然是同一个导演  有些笑点真的好尴尬  2星给那首 一生所爱
2.0, 做为一个男人，我想跟唐嫣说，朱茵的胸围都秒杀你好几圈了。其实我很想看苍老师演紫霞的。
1.0, 可怕到底谁是孙悟空
1.0, 垃圾
1.0, 「多余的月光宝盒」除了紫霞，谁也不在意500年后的情缘。你终其一生寻找这一世的自己就好。
3.0, 有一点失望。。我超喜欢大话西游一二部，第三部总感觉差一点。。
