5.0, 来提分的，不至于5.几分这么烂。诚然刘镇伟今年烂片连连，原本冲着无聊和前怀而去，但居然比想象中要好不少。除了剧情，没内涵，没星爷也算值得一看的爆米花
1.0, 垃圾。
1.0," 现在正在电影院里看着，左手边装可乐的杯子上一共有56个方格子，其中有41个是正方形，15个是长方形。右手边的椰子片净含量是40克，大约有70片,被我吃了12片，还剩下52片，它的生产日期印在了包装底部是2016年6月5号……这部电影让我观起来相当愉快"
1.0," 看了没一会儿我就哭了，
真的，
撕心裂肺的。


我是真的心疼我的票钱💰"
3.0, 经典是不能复制的！
5.0, 我糖的新电影，不得不说糖糖还是适合古装，紫霞出来的那一幕秒了我，演的很自然，紫霞青霞自由转换，韩庚演的也很好演出了自己的特色，电影的特效很赞，吴京的唐僧笑点足，整部影片很欢乐，团圆的结局又有凄美的感觉，值得一看。
1.0, 可以给负分就好了，本来是想看看能烂到哪去的，没想到被刷新了底线。无法想象星爷会是怎样的沉默
1.0, 狗屎
4.0, 看了之后觉得还可以   有的台词很搞笑   但讲的应该是青霞和六耳泥猴的故事吧   得好好理理才能知道它在讲什么的feel    有的转折有些许牵强  但总体还是不错的
1.0, 贵圈真乱
2.0, 有些经典虽然难已超越，但是至少要用心拍吧，这只会打打闹闹是干嘛
1.0, 这是我看过的最烂片 没有之一
2.0, 好无聊
1.0, 看着那些炫目的特效，心却是凉的
2.0, 演白晶晶的演员的演技都要比紫霞的好N倍，真的不要去看，真的！！有些场面很恐怖，假孙悟空剃毛满身血痕、牛魔王妹妹吃人的那一幕你确定真能给孩子看？
1.0, 没有之前两部好
1.0, 看得我尴尬癌都犯了
2.0, 没新意，无聊的电影，韩庚演技原来那么差的。
1.0, 为什么不能给0分？
1.0, 一星给吴京 其他的…算了吧……
5.0, 看了好多人说烂片后，特意去注册一个豆瓣来评5星
3.0, 看完，觉得导演脑洞真大！唐嫣皮肤真好，不过星爷的才是我心中的经典（这应该叫先入为主），个人认为所谓经典指的是无法被超越吧～
5.0, 还不错
0, 从电影院出来听见一个人对他女朋友说：这部电影像你一样傻逼！
3.0, 单论电影其实没辣么糟糕、但是珠玉在前相比之下只能呵呵..............可谓成也大话西游败也大话西游，这个名字会让大家进电影院付钱，但是这个名字也让人对电影没有期待，超越经典总是那么难。
4.0, 瞎编
1.0, 毫无感觉，剧情乱套，演员差了点真情，就秀了个特效，商业烂片。
2.0, 打两星，这两星全部是给技安的同情分，经典就不要拿出来过度消费了，虽然你是想把悲剧改成皆大欢喜。吴京演技还真不错，看来好演员就是什么样子的烂片都能演出彩。
1.0, 简直了
4.0, 想要超越经典真的很难，但是抛开成见，个人觉得还不错！
1.0, 真的破坏了经典，垃圾的不能再垃圾
1.0, 尴尬癌犯了，一星只给唐嫣美女，其他都不说了
2.0, 演技尴尬，每次看这种片子头两分钟都看不进去在讲什么，到玉皇大帝和六耳猕猴对话的那段，那语气，直接让我调戏到报告老板……比较喜欢牛魔王他妹
1.0, 刘镇伟╮（╯＿╰）╭
1.0, 能给零分么？冒着台风去看的，结过就这？各种莫名其妙的剧情，强行搞笑点～～红孩儿居然是玩陀螺的～～牛魔王居然有个妹妹还变成了死亡之翼～～～～分分钟跳戏～～
1.0, 唐嫣你还我紫霞仙子，你那斩男色真的配不上紫霞，你那脸没有爱恨情愁，上面就刻了一个字，懵b的懵字，你的眼神也不行，没有热烈，只有凉薄，紫霞的眼神，至尊宝有时不敢直视，那里面全是火焰，你呢？空洞！总之一个字，毁了！！！刘镇伟刘老头，我憎恨你
2.0, 没看懂？？演技？？剧情？？
1.0, 我只想说：我十二岁的儿子都看不下去了。
1.0, 为什么豆瓣没有负分选项！为什么！！！
1.0, 美好的中秋夜晚，因看了一部电影，像吃了个苍蝇月饼，恶心死了。。一颗星真的给多了！！
4.0, 感觉还是可以的吧，没有想象中的那么差，感觉是烂开头，开始都不想看，但是后面的还是不错的。
4.0," 挺不错的,wj很搞笑，第一次觉得ty演技在线"
5.0, 这版大话西游拍出了原版的味儿。甚至，台词的精彩指数照前篇有增无减！
3.0, 开的脑洞还挺喜欢
1.0, 辣眼睛！毁经典！
5.0, 刚看完，觉得就这样吧 但一推喷子骂演员的嘴脸太恶心了 ，至于朱茵并不觉的她漂亮而且她并不是紫霞只是演了这个人物罢了，而且当初只是演了一个恋爱中的女人罢了，并无演技。至于周星驰当初演的孙悟空我觉得就是恶搞而已。
4.0, 真心不错，比预计的好很多，如果不受前作影响可能口啤更好
1.0, 我真不想说我看过……不做评价，所有的一星评论都是我想说的
4.0, 其实还算不错 情节够完整 无厘头不算过 演员也还过得去 青霞和六耳猕猴的爱情也是让人动容的
0, 看过的最烂的电影 没有之一
5.0, 搞笑
1.0, 。。。。
0, 这片不好，演员选错了，情节没有，特效渣。。可是那么多人吐槽说明还是有很多人看了的，有些好的电影看的人都说好，可是看的人少啊
3.0, 勇气可嘉
2.0, 怎么看都像是韩庚唐嫣在cos原版 一分给阿娇的颜 回来后赶紧看前两部压压惊
5.0," 从未想过要超越经典，更没有想过能超越经典。星爷和朱茵的至尊宝和紫霞永远都是所有人心目中的经典，不会被超越。喜欢六耳猕猴和青霞，吴京真是承担了绝大部分的笑点啊。特效做的还算良心。韩庚和唐嫣的演技都有进步。尊重所有看过之后觉得好看或是觉得烂片的评价。有些看都没看无脑黑的lowB,呵呵"
2.0, 乱七八糟
3.0, 比想象中好看 当然能改名是最好的 毕竟和原著基本无关 顺便求唐嫣口红色号
1.0, 亏了我的电影票，真特么难看，还恶搞一生所爱，侮辱了星爷的大话西游
3.0," 看完大话3出来几个5、6岁的10后互相问喜欢谁，四个小男孩全部说喜欢青霞。

喜欢紫霞仙子的我们已经老了。[em]e400842[/em]"
2.0, 和符合现在大部分观众的水平，现在的电影水平高的真不多
1.0, 我知道会很烂的……但我没想到会这么烂……无话可说了
1.0, 烂片之王
3.0, 没有星爷的大话西游，就不是大话西游，狗血的剧情，，渣渣的结尾，，，
3.0, 无论谁出来演主角，都会被骂。作为一个没有看过大话西游的人，单纯从剧情和演员的角度看。都一般，但是没有想象中那么差吧。
1.0, 太……垃圾了……完全不知道演的是什么玩意～
1.0, 我只想和刘镇伟导演说一句，没才华了就退休吧，为什么来毁经典，噩梦啊！！！！
4.0, 喜欢这部影片，紫霞的角色惊艳到我了，很喜欢。
1.0, 狗尾续貂好坏还是条狗尾巴，这个呢，一团杂毛，懒得吐槽
1.0, 一颗星，给《一生所爱》
4.0, 大话西游3片中隐忍的青霞，有爱的悟空，好玩的唐僧。都让人有爱得不要不要的
4.0, 反正我挺喜欢唐嫣的，虽你们怎么黑吧。
5.0, 韩庚演的是至尊宝不是周星驰，唐嫣演的是紫霞仙子不是朱茵。他们做的不是还原经典，而是延续。他们对至尊宝和紫霞仙子有着自己的看法和思想，有另外的表现方式。经典固然是经典，但是以经典为框架去否定后来的，不说其他的，是不是太幼稚了？
4.0, 冲着大话看的 哪有1星那么烂 脑洞打开 厅里人不多 但是也欢笑不断
2.0, 开头一段看得尴尬症直犯，各种流行词的使用让人有些反感，剧情人物之间的关系让人头疼，不得不说年轻演员就是没有经验也不会表演，好好的歌手好好唱歌就行，跨什么演艺圈，特效也一般，剧情说实话不想过多的吐槽，心疼莫文蔚。
1.0, 呵呵
1.0, 无与伦比的烂，心疼我的票钱。
3.0, 韩庚和唐嫣实在没法和周星星朱茵比，硬搞笑有些尴尬。
1.0, 一星给特效和电影院的爆米花，硬要拗笑点真的尴尬尴尬尴尬！无聊剧情(._.)
3.0, 看这部片子之前我是做了心理准备的。我设想过情节会是多么跳跃多么脑洞大开，也估计过特效会是多么天花乱坠，然而当我看完之后我还是禁不住😔😞😒😰😱😥。开头半小时我完全没理解编剧到底想干嘛，中间我只想在心底默念一万遍卧槽，结尾则是一万遍什么鬼。
3.0, 唐嫣傻白甜 韩庚无演技  不要掏钱了…
4.0, 剧情不错 赞编剧 想象力不错 与第一部剧情天壤之别 又 如出一辙 偶尔有点小笑点 另外 唐嫣演技有所提高 韩庚演出了天真的至尊宝 何炅这酱油打得  吴京和谢楠夫妇
1.0, 垃圾垃圾垃圾。还5.7分？臭不要脸。。
2.0, 搞笑是搞笑。但是特别乱喜欢乱插元素，现在国产片都有这个特点吧。
1.0, 唐嫣的SB演技简直不要太恶心人！不愧是中戏之耻！刘镇伟除了炒冷饭拿周星驰做噱头还会什么？真当内地人是傻子呢？
5.0, 真的不错，不知道那么多一星都是哪个竞争对手刷的
5.0, 这电影真的值得一看，说唐嫣演技不好的，麻烦看了电影再给予评价好吗，负责人的说，演技在线，所有遗憾都弥补了，还想在看第二遍
2.0, 不知所云
5.0," 我没有看过周星驰版的大话西游
只是以纯路人的角度来看这部电影
觉得还可以
特效也还不错"
1.0, 水军去死
1.0, 狗尾续貂
3.0, 吴京的唐僧还是可以的，紫霞我也勉强过了，可是至尊宝实在忍不了，演技超级烂
5.0, 平心而论，4星吧。不过，看评论 要给5星。    不错，值得一看。 个人认为比 西游降魔好
1.0, 怎么都是1星还有5.8分，中国电影就让他们这群导演跟所谓演员给毁了。
1.0, 一星都不想给，太烂了，糟蹋经典，看到一半就想出来，剧情蹩脚，演技太烂，十年前的弱智逗乐套路居然还在用，实在忍不住想骂，浪费三十元，没看的还是不要花冤枉钱了
1.0, 一定乘着市场好把一些经典电影都毁了的节奏吗？？？
1.0, 刚才5.0，现在就5.8了？水军呵呵呵。
1.0, 渣
1.0, 我真的哭了，因为就像歌词里唱的那样，从前过去错过了，再也回不来
5.0, 熟悉的音乐声响起，我湿润了
2.0, 超越不了经典，还是愿意去看，因为宣传说是故事重建，可是看了，故事很烂，很乱，最终变成青霞和六耳猕猴的爱情故事，城楼上的，依旧是紫霞和至尊宝，但是给了至尊宝和紫霞好的结局，却破坏了前两部的故事。至于演员的表演，不想评价，不能说是烂片，毕竟竭尽全力的，给了紫霞和至尊宝一个好结局。
3.0, 今天看了，虽然说和前2部不能比，但是也不该只值1星，3星左右还是应该有的。里面的3d特效做的还不错，另外情节设定也够狗血，说唐僧是六耳猕猴和青霞的儿子（不算剧透吧）。
2.0, 两星，给莫文蔚和青霞。莫文蔚怎么会接了这种电影，唐嫣还是走御姐风吧，别傻白甜了。
5.0, 剧情流畅，唐嫣分饰两角演技很好，大赞👏👏👏
5.0, 三星吧，多给两星是因为乱刷一星的，笑点有几处，特效还可以，剧情有点扯，
1.0, 现在电影的钱都给了演员的片酬了
3.0, 我没有看过周星驰版本的，感觉还行
2.0, 新出的故事线和主角，是部分弥补了前两部故事的漏洞，却也造成了新的漏洞，1.2毁了，为了3。意境，情节全没了。刘导，若是为了你想要个完美的结局，和对1.2的补充。你开心就好，我尊重。我觉得不值啊。
4.0, 没有想象中烂
1.0, 我不想说什么。。星爷无人能抵过他的演技。和封神一个样。
1.0, 只想问为什么没有半星?
1.0, 为什么豆瓣会有5.8分？谁能告诉我
2.0, 虽然结局较完美，不过还是喜欢大话12，求别毁经典
1.0, 看完之后，我只觉得这个关系好乱伦
5.0, 这回的化妆术不得了啊，极大的增添了喜剧效果，相比之前两部，真是青出于蓝胜于蓝。
1.0, 啊西吧！！！
2.0, 二星吧！毕竟不是一个档次！笑话而已，至尊宝不是去过去找白晶晶了吗？虽说紫霞仙子看过未来，为什么没娶亲之前就喜欢上紫霞了？看都不看白晶晶一眼
1.0, 真心不要去看，浮夸的演技辣眼睛。
1.0, 我是疯了才会被这样的垃圾电影糟蹋！怎么没有负分呢！！
5.0, 看得出来，还是很用心的。
5.0, 唐嫣还是美丽的！尽管演技不尽如人意，但是我家范冰冰也是渣渣的演技和傲娇的颜值成反比
1.0, 前作留下的种种悬念根本不需要去填补，留给人无限的遐想就是最好的结局，就像那句话说的，一千个读者就有一千个哈姆雷特，你有你的，我也有我的思想。
3.0, 觉得整部电影的亮点就是吴京，有一些笑点比较牵强但是整体感觉还是不错的。韩庚还不错，当六耳猕猴出来说自己叫秦祥林时被帅到了，唐嫣演的紫霞仙子漂亮是少了仙气。而且紫霞是一个傻白甜，但我感觉紫霞仙子只演出了傻。但是青霞的感觉还不错，整部电影偷梁换柱其实讲的是青霞和六耳猕猴的爱情。
4.0, 现实生活中有月光宝盒就好了。倒流那些一想起来梅花都能落满整座南山。  至尊宝和紫霞终于在一起了。真是羡慕极了
1.0, 一句话，这是什么玩意儿
1.0, 侮辱经典哈
1.0, 韩庚，呵呵。
1.0, 很少专门登录来评1星（为什么没有负分），必须拉低水军猖獗的分数。
1.0, 钱没地方花就去看，这几年最烂最烂最烂的片子
5.0, 不是不能看，而是还可以
1.0," 看到有这么多人骂我就放心了。
抱着大话西游前两部的情结去看的，结果不到半个小时就恨不得马上离开电影院了。这样的烂片，倒贴钱给我都不想看！整部电影充斥着低俗、恶心的画面，我想不明白为什么电影院里有很多人笑得那么嗨。给一星我都觉得太多！"
2.0, 就挺搞笑的吧 不过还是很多要睡着 😃
5.0, 特效做得很精彩，电影还是有情怀的，当《一生所爱》一出，还是会热泪盈眶，虽说最后皆大欢喜，还是会让人想起那令人难以忘怀的辽阔的命运，人生本就是天意，非如此不可！
3.0, 编剧脑洞大开 其实看着玩儿还可以😂😂😂 #论意中人都是踏着七色彩云的盖世英雄
1.0, 一般我不给差评，但看了蜘蛛网9.1的评分和这里水军的刷屏，我觉得不给差评都对不住自己！
1.0, 就一个字烂
3.0, 还行
0, 你们这说得我都不想看了！
4.0, 90后小鲜粉一枚，讲真，这样的大话西游真是改变了我对西游记得固有认知呢，感觉世界观都被颠覆啦
3.0, 故事情节还可以，可以说是对前两部的解释说明，3D效果很炫，画面很美，唐嫣的装束也很漂亮，还真有点像朱茵版！韩庚真不适合演搞笑剧，确实很尴尬！本来很不看好吴京演唐曾，没想到吴京竟然是个彩蛋，成为了整个电影的搞笑和演技担当！但是挑战经典太难了，总觉得缺少精气神在里面！
1.0, 标榜3d效果，但是……但是，最最主要的是，越看就越让人觉得经典的魅力……
1.0, 毁经典一星都嫌多
5.0, 比预期的好。我以为翻拍经典会很烂的。
5.0, 非常好看
1.0, 烂片之王 光腚总菊 应该把这些烂片禁掉
1.0, 所以，这部片到底想说什么？？？
3.0, 唐嫣只适合演青楼女子
4.0, 其实挺不错的，不像大家评论的那么烂。可以把这部看成大话2的另一种结局。值得一看。
1.0, 经典永远都是经典，不管翻拍也好续集也罢，是无法替代的。只有悲情的结局才会让人引发对往事的共鸣，正因为悲情才让人久久怀念，正因为悲情铸就了永世经典，至尊宝和紫霞仙子的爱是伟大的，只有相恋中的周星驰和朱茵才能用真实情感去演绎去描绘。每个人都心怀一种爱恋，珍惜眼前人。
0, 继朱茵之后，世间再无紫霞仙子，因为紫霞就是朱茵，朱茵就是紫霞。
1.0, 屎都无法形容的烂
4.0, 算是刘镇伟这些年里上佳的作品了，刘镇伟真是才尽了，接这部戏的演员也不容易，吴京算是一大亮点全程的笑点难得，韩庚演技现在是真不错，相比压力山大的至尊宝，更喜欢他六耳猕猴的演绎，无论是肢体还是表演的拿捏都很到位，唐嫣一贯水平不多评价，整体上佳比较有诚意，意料之外。
5.0, 真正和他在一起看的第一部电影。曾经有一份真挚的爱情摆在我面前我没有珍惜，现在我不会错过第二次。兜兜转转还是你的感觉，真好。中秋节快乐❤️
1.0, 好多水军？
1.0, 好多水军？
2.0, 烂片，我一点都笑不出来，看的尴尬到脸酸。导演在可以卖弄那些过时的梗，演员演的也不经心，就只说牛魔王最后被妹妹吃了的那一幕，导演你不知道什么叫打不过还能跑么？非要强行煽情，我看的脸酸！！尴尬无比。
1.0, 唐阉和含羹。特效不错。
5.0, 唐嫣演技有进步，装扮也很好看，整个过程中影院都很嗨，看得出来还不错，受众感可以
5.0, 六耳猕猴
4.0, 珠玉在前，被比较是肯定的，3有他特有的时代特色，以六耳猕猴跟青霞是主线，前20分钟给我感觉一头雾水，20分钟之后就明白前面在讲什么了。唐僧出来后笑点不断，3把1和2的故事圆的不错，就是脑洞有点大，至于演员表演的刻画被特效掩盖了，表演无功无过吧！开头结尾太仓促了。单纯喜剧来看的话还是不错的
2.0, 还是别再摧残经典了！！！
1.0, 难看演技太差了
3.0, 五百年的轮回一样的结局
3.0, 在家看了资源  不想要去电影院了  对不起自己
5.0, 喜欢唐嫣
1.0, 没说的，失望
3.0, 这不是烂片，是脑残片。。。国产片来说，特效不错，没了。。。台词脑残，网络流行语东拼西凑起来的低端笑点简直尴尬，一部小学生心爱的喜剧电影，你值得拥有
4.0, 虽然不是星爷主演，但表示唐嫣演紫霞真的很好看，还有非常巧妙的把六耳猕猴联系起来，情节给个赞
1.0, 烂片 感动
5.0, 比想象中好看，挺棒的。
5.0, 六耳猕猴与青霞很有泪点。至尊宝与紫霞很有笑点 牛家人很不正常，唐僧是个需要爸爸保护的逗逼。整部剧有感动，有欢笑，没人离场。六耳猕猴很酷很酷，至尊宝很逗很逗，孙悟空很狂很狂，而他演的很好很好。 你有你的至尊宝，我有我的六耳猕猴，电影昨天晚上才上映，真不知道豆瓣哪来的那么多先知👎
1.0, 如果打算看情怀的，那就算了，真心垃圾
1.0, 请了这么多水军 有没有搞错 昨天看还是4点几分 今天就快6分了 这么烂的电影 几百年难遇一次
1.0, 吓得我赶快回去看星爷的大话。
1.0, 请了这么多水军 有没有搞错 昨天看还是4点几分 今天就快6分了 这么烂的电影 几百年难遇一次
1.0, 吓得我赶快回去看星爷的大话。
1.0, 一分，是给“大话西游”这四个字的，其余无关。
5.0, 还可以
1.0, 三无作品
5.0, 喜欢这部剧，有笑声有感动，所谓自由不过是一种漂泊，致一生所爱，喜欢
3.0, 三星平衡一下吧
1.0, 只能给一星，不能再多了！！！！！真的不能再多了！！！！！
1.0, 唐三藏是六耳猕猴的儿子，可以可以～
1.0, 看完这部爸爸去哪儿，无力吐槽，我选择死亡！！！！！导演编剧，呵呵！现在的拍电影都不要智商吗？真正的烂片，不知道雇了多少水军！真的太烂！！烂啊！！！
1.0, 原本就普通的《大话西游》竟然被奉为经典，真的有评论的那么好吗？有多少人真觉得好，又有多少人是跟风叫好。刘导演的才华被内地观众强行解读出来，所谓大话，其实不过是个笑话。
5.0, 《大话西游3》的阵容颜值前两部那简直一脚登天啊，哈哈。
1.0, 笑话西游吧？
5.0, 一星给莫文蔚，一星给吴京，一星给六耳猕猴，一星给青霞，最后一星大脸乱喷跟风的黑子。紫霞看到自己死后孤独的至尊宝，宁愿自己孤独一生，也不愿他爱上自己。让人难过。青霞为了妹妹的美好结局，甘愿牺牲，小六的放浪不羁爱自由，就算知道还能再见，但青霞闭上眼时的撕心裂肺，还是让人心疼不已！
1.0, 我只想说经典的确是可以被突破   但是绝不是被你们这样突破的    粗制滥造
1.0, 辣眼睛，毁经典。
5.0, 真的没你们吹的那么烂，，唐嫣韩庚的演技也没那么出戏。新编曲一生所爱蛮好听的。确实有些地方可以模仿周星驰和夸张效果不好。大概7丶8分的样子吧。只是可以差评的人太多了。可以不要活在过去吗？喜欢星爷的就去看1和2阿，来喷3找什么存在感。行了行了知道你们有情怀了。
5.0, 超出预期，喜剧效果整体比预告片展现得流畅自然得多，特效很赞。作为商业片来说还是挺赞的。
2.0, 看完之后，只觉得，这电影只是在强行圆满，六耳猕猴都来了，就算是大话，你让他当唐僧的老爸，也有点过了吧。
1.0, 太差了，失望，好不容易哄老公去了电影院，结果看了20分钟，被他吐槽，拍的什么乱七八糟的，毁了我的大话西游。
4.0, 本来以为刘镇伟这次又是吃老本，没想到意料之外的好，脑洞大开的圆了二十多年前的一个故事，让至尊宝和紫霞有一个完美的结局，也重新塑造了一个以前从未被人关注的六耳猕猴和背景板一般的青霞，他们的爱情相比更加刻骨而悲剧，从心里喜欢这对cp，特效良心，不落俗套，没看得出来刘镇伟这次真的用心了
0, 因为之前看大话西游1和2的时候有点看不懂，后来才有了点所谓情怀，今天中秋放假带弟弟去看电影，就这部他还能看，就去看了这一部。我觉得很不错，是一步合格的商业片，大家的演技都不会让人出戏，除了何老师稍微有点，o(∩_∩)o 哈哈，还是很值得在中秋节的时候阖家欢的，算是中秋档里很满意的了。
1.0, 冷饭，全都是冷饭。
1.0, 曾经让人感动的情节、音乐 没想到有一天会变得这么尴尬
4.0, 很不错，没有失望
1.0, 没看过前两部，不比较，只是完全看不懂剧情，根本不知道在讲什么。
1.0, 国产电影真是孜孜不倦的生产垃圾
1.0," 无力吐槽，就当没看过
得出的经验就是一定要先看豆瓣评分"
1.0, 还是喜欢周星驰和朱茵
3.0, 演员可观，剧情混乱，最后只剩一生所爱
1.0, 韩庚的零演技、硬掰的剧情，分分钟要你尴尬症都犯了，这种烂片最高别和大话西游扯上什么关系，别把经典给毁了，真的怒了……
5.0, 带着孩子去看的，没什么矫情的情怀。最直观的感受是脑洞大，但还是圆回来了。有笑点，能打动我的约5.6处，反正很久没在电影院看电影笑过了。特效不错，记得有几个镜头把小妹儿下了一大跳。剧情发展较快，有点没回过神来，其实结尾如果多个十来分钟也许故事会上一个台阶，音乐很好听，还不错。
1.0, 刘镇伟你个臭傻逼！能不能退我票钱！
2.0, 狗尾续貂
2.0, 唐嫣的紫霞，韩庚的至尊宝扮相还是可以的，只是剧情太扯了，什么玉皇大帝写错天数，六耳猕猴和青霞生的儿子是唐僧，有点怀疑至尊宝还是孙悟空吗？无语的编剧，很失望。
1.0, 到底在看什么东西，完全没演技
5.0, 昨天晚上和女友看的，说实话看之前很忐忑，老实说对这个阵容很担心，没想到开局后很惊喜，前面稍微有些乱，唐僧出来后渐入佳境，无尿点，全场爆笑数次，算是值回票价。
4.0, 大话2给了大话1一个交代，大话3给了大话一个交代，经典不复制，但是经典可以延续，不得不说唐嫣的青霞韩庚的六耳猕猴的爱情让我感动，可能泪点低，哭了2次，尤其是所谓的自由不过是种漂泊，推荐
5.0, 在电影里看到了唐嫣的认真和努力
2.0, 给两颗辛苦星。别的都不知道说什么。
1.0, 一点也不好看，剧情在讲什么都不知道
1.0, 毁经典 烂
4.0, 打一星的太多，星爷情节太重了。老实说，第一次在电影院看月光宝盒的时候也不觉得怎么样，后来越看越喜欢。这部戏应该还会让人再看一遍。
1.0, 坑了大话西游四个字
1.0, 这1星是给莫文尉的，今年看片36部，这是我唯一中途退场的一部，这部大话西游3，完全搞不懂为什么叫“3”，把经典恶搞一下重拍，还好意思叫3，这相当于在市场上拼凑一部山寨机，取名lPhone8，观后感：骗钱！远离刘镇伟！
